,Dist,Genre,Gross,MPAA,actors,budget,directors,producers,rel_date,title,writers,ROI,Action,Adventure,Animation,Comedy,Crime,Drama,Fantasy,Horror,Romance,Sci-Fi,Thriller
391,Relativity,"('Fantasy', 'Drama')",92343400,R,Henry Cavill/Freida Pinto/Kellan Lutz/Mickey Rourke,80934663.53879069,Tarsem,Mark Canton/Ryan Kavanaugh/Gianni Nunnari/Tucker Tooley,2011-11-11,Immortals,,0.1409623017181172,0.0,0.0,0.0,0.0,0.0,1.0,1.0,0.0,0.0,0.0,0.0
392,Miramax,"('Drama',)",53596100,R,Tom Wilkinson/Marisa Tomei,2311081.2061599875,Todd Field,Todd Field/Ted Hope/Ross Katz/Graham Leader,2001-11-23,In the Bedroom,,22.190920274520956,0.0,0.0,0.0,0.0,0.0,1.0,0.0,0.0,0.0,0.0,0.0
393,Warner Bros.,"('Drama',)",24933000,PG-13,Tom Holland/Chris Hemsworth/Cillian Murphy/Ben Whishaw/Brendan Gleeson,100730000.00000001,Ron Howard,,2015-12-11,In the Heart of the Sea,Charles Leavitt,-0.7524769184949867,0.0,0.0,0.0,0.0,0.0,1.0,0.0,0.0,0.0,0.0,0.0
394,Fox,"('Sci-Fi', 'Thriller')",41490300,PG-13,Justin Timberlake/Amanda Seyfried/Cillian Murphy/Olivia Wilde/Alex Pettyfer,43165153.88735503,Andrew Niccol,Marc Abraham/Arnon Milchan/Eric Newman/Andrew Niccol,2011-10-28,In Time,Andrew Niccol,-0.0388010637405759,0.0,0.0,0.0,0.0,0.0,0.0,0.0,0.0,0.0,1.0,1.0
395,Warner Bros.,"('Sci-Fi', 'Action')",318705600,PG-13,Leonardo DiCaprio/Joseph Gordon-Levitt/Marion Cotillard/Ellen Page/Tom Hardy/Cillian Murphy/Michael Caine,175250524.7826614,Christopher Nolan,Christopher Nolan/Emma Thomas/Thomas Tull,2010-07-16,Inception,Christopher Nolan,0.81857144448067,1.0,0.0,0.0,0.0,0.0,0.0,0.0,0.0,0.0,1.0,0.0
396,Warner Bros. (New Line),"('Comedy',)",24395400,PG-13,Steve Carell/Jim Carrey/Olivia Wilde/James Gandolfini,30905394.366000004,Don Scardino,Chris Bender/J.C. Spink,2013-03-15,The Incredible Burt Wonderstone,Jonathan M. Goldstein,-0.2106426563888747,0.0,0.0,0.0,1.0,0.0,0.0,0.0,0.0,0.0,0.0,0.0
397,Universal,"('Action', 'Adventure')",162594400,PG-13,Edward Norton/Liv Tyler/William Hurt/Ty Burrell/Michael K. Williams,168918144.9955321,Louis Leterrier,Avi Arad/Kevin Feige/Gale Anne Hurd/Stan Lee/David Maisel/Jim Van Wyck,2008-06-13,The Incredible Hulk,Zak Penn,-0.03743674189471691,1.0,1.0,0.0,0.0,0.0,0.0,0.0,0.0,0.0,0.0,0.0
398,Buena Vista,"('Animation',)",363979400,PG,Craig T. Nelson/Holly Hunter/Samuel L. Jackson,118078308.34807998,Brad Bird,John Lasseter,2004-11-05,The Incredibles,Brad Bird,2.0825255298122545,0.0,0.0,1.0,0.0,0.0,0.0,0.0,0.0,0.0,0.0,0.0
399,Paramount,"('Adventure',)",382464600,PG-13,Harrison Ford/Cate Blanchett/Shia LaBeouf,208332378.8278229,Steven Spielberg,George Lucas/Frank Marshall,2008-05-22,Indiana Jones and the Kingdom of the Crystal Skull,David Koepp/George Lucas/Jeff Nathanson,0.8358384911261891,0.0,1.0,0.0,0.0,0.0,0.0,0.0,0.0,0.0,0.0,0.0
400,Warner Bros.,"('Drama', 'Thriller')",38235900,R,Matt Damon,24752384.1203031,Steven Soderbergh,Jennifer Fox/Gregory Jacobs/Jeff Skoll,2009-09-18,The Informant!,Scott Z. Burns,0.5447360470071676,0.0,0.0,0.0,0.0,0.0,1.0,0.0,0.0,0.0,0.0,1.0
401,Warner Bros. (New Line),"('Fantasy',)",20086800,PG,Brendan Fraser/Paul Bettany/Helen Mirren/Andy Serkis,67506502.14628118,Iain Softley,,2009-01-23,Inkheart,David Lindsay-Abaire,-0.7024464405447417,0.0,0.0,0.0,0.0,0.0,0.0,1.0,0.0,0.0,0.0,0.0
402,Universal,"('Crime', 'Thriller')",117027000,R,Denzel Washington/Clive Owen/Jodie Foster/Willem Dafoe/Chiwetel Ejiofor/Christopher Plummer,54082673.83387742,Spike Lee,Brian Grazer/Jon Kilik,2006-03-24,Inside Man,,1.163853813135515,0.0,0.0,0.0,0.0,1.0,0.0,0.0,0.0,0.0,0.0,1.0
403,Buena Vista,"('Animation',)",373995900,PG,Mindy Kaling/Diane Lane,176277500.0,Pete Docter,John Lasseter/Jonas Rivera,2015-06-19,Inside Out,Josh Cooley/Pete Docter/Meg LaFauve,1.1216315184864771,0.0,0.0,1.0,0.0,0.0,0.0,0.0,0.0,0.0,0.0,0.0
404,FilmDistrict,"('Horror',)",90926300,PG-13,Rose Byrne/Patrick Wilson,5150899.061000001,James Wan,Jason Blum/Brian Kavanaugh-Jones/Oren Peli,2013-09-13,Insidious Chapter 2,Leigh Whannell,16.65251054683791,0.0,0.0,0.0,0.0,0.0,0.0,0.0,1.0,0.0,0.0,0.0
405,Warner Bros.,"('Thriller',)",100395600,R,Al Pacino/Robin Williams/Hilary Swank/Martin Donovan,61580638.62099773,Christopher Nolan,Broderick Johnson/Andrew A. Kosove/Steven Soderbergh/Emma Thomas,2002-05-24,Insomnia,,0.6303111212907619,0.0,0.0,0.0,0.0,0.0,0.0,0.0,0.0,0.0,0.0,1.0
406,IFC,"('Crime', 'Comedy')",1250900,R,Colin Farrell/Cillian Murphy,6417299.366743477,John Crowley,,2004-03-19,Intermission,,-0.8050737656898836,0.0,0.0,0.0,1.0,1.0,0.0,0.0,0.0,0.0,0.0,0.0
407,Warner Bros.,"('Comedy',)",75419000,PG-13,Robert DeNiro/Anne Hathaway/Rene Russo,35255500.0,Nancy Meyers,,2015-09-25,The Intern,Nancy Meyers,1.1392123214817547,0.0,0.0,0.0,1.0,0.0,0.0,0.0,0.0,0.0,0.0,0.0
408,Sony / Columbia,"('Drama', 'Thriller')",29544400,R,Clive Owen/Naomi Watts,56255418.45523432,Tom Tykwer,Ryan Kavanaugh,2009-02-13,The International,Eric Warren Singer,-0.47481681211721527,0.0,0.0,0.0,0.0,0.0,1.0,0.0,0.0,0.0,0.0,1.0
409,Fox,"('Comedy',)",46165400,PG-13,Vince Vaughn/Owen Wilson/Rose Byrne/Josh Gad,59750429.1076,Shawn Levy,Shawn Levy/Arnon Milchan/Scott Stuber/Vince Vaughn,2013-06-07,The Internship,Vince Vaughn,-0.22736287103705577,0.0,0.0,0.0,1.0,0.0,0.0,0.0,0.0,0.0,0.0,0.0
410,Universal,"('Thriller',)",98229800,PG-13,Nicole Kidman/Sean Penn/Sydney Pollack,99435202.27377072,Sydney Pollack,Tim Bevan/Eric Fellner/Anthony Minghella/Kevin Misher/Sydney Pollack,2005-04-22,The Interpreter,Scott Frank/Steven Zaillian,-0.012122490287211685,0.0,0.0,0.0,0.0,0.0,0.0,0.0,0.0,0.0,0.0,1.0
411,Paramount,"('Sci-Fi', 'Adventure')",196490500,PG-13,Matthew McConaughey/Anne Hathaway/Jessica Chastain/Casey Affleck/Topher Grace/Michael Caine,167467654.20000005,Christopher Nolan,Christopher Nolan/Lynda Obst/Emma Thomas/Thomas Tull,2014-11-05,Interstellar,Christopher Nolan,0.17330418783641122,0.0,1.0,0.0,0.0,0.0,0.0,0.0,0.0,0.0,1.0,0.0
412,Warner Bros. (New Line),"('Thriller',)",50988300,PG-13,Jeremy Sumpter,50747774.000000015,Steven Quale,Todd Garner,2014-08-08,Into The Storm,John Swetnam,0.0047396364616896225,0.0,0.0,0.0,0.0,0.0,0.0,0.0,0.0,0.0,0.0,1.0
413,Warner Bros.,"('Fantasy', 'Comedy')",20997100,PG-13,Ricky Gervais/Jennifer Garner/Rob Lowe/Jonah Hill/Tina Fey,20814504.8284367,Ricky Gervais,Dan Lin/Lynda Obst,2009-10-02,The Invention of Lying,,0.008772496538752117,0.0,0.0,0.0,1.0,0.0,0.0,1.0,0.0,0.0,0.0,0.0
414,Warner Bros.,"('Drama',)",42138000,PG-13,Matt Damon/Morgan Freeman,67506502.14628118,Clint Eastwood,Gary Barber/Roger Birnbaum/Robert Lorenz/Tim Moore,2009-12-11,Invictus,,-0.375793461958815,0.0,0.0,0.0,0.0,0.0,1.0,0.0,0.0,0.0,0.0,0.0
415,Paramount,"('Action', 'Adventure')",384034200,PG-13,"Robert Downey, Jr./Terrence Howard/Gwyneth Paltrow/Jeff Bridges/Clark Gregg",157656935.32916328,Jon Favreau,Avi Arad/Louis D'Esposito/Jon Favreau/Kevin Feige/Stan Lee/David Maisel,2008-05-02,Iron Man,Mark Fergus/Hawk Ostby,1.4358852288876225,1.0,1.0,0.0,0.0,0.0,0.0,0.0,0.0,0.0,0.0,0.0
416,Paramount,"('Action', 'Adventure')",340336200,PG-13,"Robert Downey, Jr./Don Cheadle/Scarlett Johansson/Gwyneth Paltrow/Sam Rockwell/Mickey Rourke/Samuel L. Jackson/Clark Gregg/John Slattery",219063155.97832674,Jon Favreau,Louis D'Esposito/Susan Downey/Jon Favreau/Kevin Feige/Alan Fine/Stan Lee/David Maisel/Denis L. Stewart,2010-05-07,Iron Man 2,,0.5535985432149602,1.0,1.0,0.0,0.0,0.0,0.0,0.0,0.0,0.0,0.0,0.0
417,Buena Vista,"('Action', 'Adventure')",422680300,PG-13,"Robert Downey, Jr./Gwyneth Paltrow/Don Cheadle/Guy Pearce/Rebecca Hall/Jon Favreau/Ben Kingsley",206035962.44000003,Shane Black,Victoria Alonso/Louis D'Esposito/Jon Favreau/Kevin Feige/Alan Fine/Stan Lee/Dan Mintz,2013-05-03,Iron Man 3,Shane Black/Drew Pearce,1.0514879780906656,1.0,1.0,0.0,0.0,0.0,0.0,0.0,0.0,0.0,0.0,0.0
418,DreamWorks,"('Sci-Fi', 'Action')",48391800,PG-13,Ewan McGregor/Scarlett Johansson/Sean Bean/Michael Clarke Duncan,156610443.5811889,Michael Bay,Michael Bay/Ian Bryce,2005-07-22,The Island,Alex Kurtzman/Roberto Orci,-0.6910052810436421,1.0,0.0,0.0,0.0,0.0,0.0,0.0,0.0,0.0,1.0,0.0
419,Universal,"('Romance', 'Comedy')",124768600,R,Meryl Streep/Steve Martin/Alec Baldwin/Lake Bell/John Krasinski/Zoe Kazan,95634211.37389834,Nancy Meyers,Nancy Meyers/Scott Rudin,2009-12-25,It's Complicated,Nancy Meyers,0.3046439993340435,0.0,0.0,0.0,1.0,0.0,0.0,0.0,0.0,1.0,0.0,0.0
420,Focus Features,"('Drama',)",6932000,PG-13,Emma Roberts/Zach Galifianakis/Viola Davis,8762526.23913307,Anna Boden/Ryan Fleck,Kevin Misher,2010-10-08,It's Kind of a Funny Story,Anna Boden/Ryan Fleck,-0.20890393810839814,0.0,0.0,0.0,0.0,0.0,1.0,0.0,0.0,0.0,0.0,0.0
421,Paramount,"('Action', 'Crime')",152416900,PG-13,Mark Wahlberg/Charlize Theron/Edward Norton/Jason Statham/Seth Green,78455335.13805905,F. Gary Gray,Tim Bevan/Donald De Line/Eric Fellner,2003-05-30,The Italian Job,,0.9427219287482445,1.0,0.0,0.0,0.0,1.0,0.0,0.0,0.0,0.0,0.0,0.0
422,Warner Bros.,"('Drama',)",41248300,R,Leonardo DiCaprio/Naomi Watts/Judi Dench/Armie Hammer/Josh Lucas,37769509.65143565,Clint Eastwood,Clint Eastwood/Brian Grazer/Ron Howard/Robert Lorenz/Tim Moore,2011-11-09,J. Edgar,Dustin Lance Black,0.09210578534561731,0.0,0.0,0.0,0.0,0.0,1.0,0.0,0.0,0.0,0.0,0.0
423,Sony / Columbia,"('Comedy',)",81985800,PG,Adam Sandler/Katie Holmes/Al Pacino/Nick Swardson/Eugenio Derbez,85251178.92752619,Dennis Dugan,Todd Garner/Jack Giarraputo/Tim Herlihy/Steve Koren/Adam Sandler/Robert Smigel,2011-11-11,Jack and Jill,Steve Koren,-0.03830303543722435,0.0,0.0,0.0,1.0,0.0,0.0,0.0,0.0,0.0,0.0,0.0
424,Paramount,"('Crime', 'Drama')",86876200,PG-13,Tom Cruise/Rosamund Pike/David Oyelowo/Werner Herzog/Jai Courtney/Robert Duvall,62886296.45593681,Christopher McQuarrie,Tom Cruise/David Ellison/Dana Goldberg/Paul Schwake/Paula Wagner,2012-12-21,Jack Reacher,Christopher McQuarrie,0.381480622902836,0.0,0.0,0.0,0.0,1.0,1.0,0.0,0.0,0.0,0.0,0.0
425,Paramount,"('Action', 'Thriller')",55020200,PG-13,Chris Pine/Keira Knightley/Kevin Costner/Kenneth Branagh,60897328.80000001,Kenneth Branagh,Lorenzo di Bonaventura/David Ellison/Dana Goldberg/Mark Vahradian,2014-01-17,Jack Ryan: Shadow Recruit,Adam Cozad/David Koepp,-0.09650881107284315,1.0,0.0,0.0,0.0,0.0,0.0,0.0,0.0,0.0,0.0,1.0
426,Warner Bros. (New Line),"('Adventure',)",70823500,PG-13,Ewen Bremner/Nicholas Hoult/Ewan McGregor/Stanley Tucci,200885063.379,Bryan Singer,Jon Jashni/Neal H. Moritz,2013-03-01,Jack the Giant Slayer,Darren Lemke/Christopher McQuarrie,-0.6474426778740598,0.0,1.0,0.0,0.0,0.0,0.0,0.0,0.0,0.0,0.0,0.0
427,Paramount,"('Comedy',)",126742700,R,Johnny Knoxville,21906315.597832676,Jeff Tremaine,Spike Jonze/Jeff Tremaine,2010-10-15,Jackass 3-D,,4.785669408165535,0.0,0.0,0.0,1.0,0.0,0.0,0.0,0.0,0.0,0.0,0.0
428,Paramount,"('Comedy',)",105839500,R,Johnny Knoxville,15452697.183000002,Jeff Tremaine,Spike Jonze/Johnny Knoxville/Jeff Tremaine,2013-10-25,Jackass Presents: Bad Grandpa,Spike Jonze*/Johnny Knoxville/Jeff Tremaine,5.849257365661534,0.0,0.0,0.0,1.0,0.0,0.0,0.0,0.0,0.0,0.0,0.0
429,Paramount,"('Comedy',)",96223500,R,Johnny Knoxville,13821127.757546453,Jeff Tremaine,Spike Jonze/Jeff Tremaine,2006-09-22,Jackass: Number Two,Spike Jonze,5.962058501156764,0.0,0.0,0.0,1.0,0.0,0.0,0.0,0.0,0.0,0.0,0.0
430,Paramount,"('Comedy',)",95758000,R,Johnny Knoxville,6693547.6761954045,Jeff Tremaine,Spike Jonze/Jeff Tremaine,2002-10-25,Jackass: The Movie,,13.306015977229672,0.0,0.0,0.0,1.0,0.0,0.0,0.0,0.0,0.0,0.0,0.0
431,Universal,"('Drama',)",84644100,R,Jake Gyllenhaal/Peter Sarsgaard/Jamie Foxx/Lucas Black/Chris Cooper,89491682.04639365,Sam Mendes,Bobby Cohen/Lucy Fisher/Sam Mercer/Douglas Wick,2005-11-04,Jarhead,,-0.05416796215631081,0.0,0.0,0.0,0.0,0.0,1.0,0.0,0.0,0.0,0.0,0.0
432,Miramax,"('Comedy',)",46031300,R,Kevin Smith/Ben Affleck/Ali Larter,29908109.72677631,Kevin Smith,,2001-08-24,Jay and Silent Bob Strike Back,Kevin Smith,0.5390909161600683,0.0,0.0,0.0,1.0,0.0,0.0,0.0,0.0,0.0,0.0,0.0
433,United Artists,"('Horror',)",57994700,R,Justin Long,13594595.330352867,Victor Salva,,2001-08-31,Jeepers Creepers,,3.2660114987398208,0.0,0.0,0.0,0.0,0.0,0.0,0.0,1.0,0.0,0.0,0.0
434,Fox,"('Horror', 'Comedy')",18642100,R,Kyle Gallner/Chris Pratt/Megan Fox/Amanda Seyfried,18001733.905674983,Karyn Kusama,Diablo Cody/Mason Novick/Jason Reitman,2009-09-18,Jennifer's Body,Diablo Cody,0.035572467501207905,0.0,0.0,0.0,1.0,0.0,0.0,0.0,1.0,0.0,0.0,0.0
435,Miramax,"('Comedy', 'Drama')",35237100,PG-13,Ben Affleck/Liv Tyler/Jennifer Lopez,44921095.56720434,Kevin Smith,,2004-03-26,Jersey Girl,Kevin Smith,-0.21557790265191934,0.0,0.0,0.0,1.0,0.0,1.0,0.0,0.0,0.0,0.0,0.0
436,Open Road Films,"('Drama',)",17815800,PG-13,Ashton Kutcher/Josh Gad/Lukas Haas,12362157.7464,Joshua Michael Stern,,2013-08-16,Jobs,Matt Whiteley,0.44115617722061184,0.0,0.0,0.0,0.0,0.0,1.0,0.0,0.0,0.0,0.0,0.0
437,Sony / Screen Gems,"('Sci-Fi', 'Horror')",13326100,R,Ice Cube/Jason Statham,38064866.92498803,John Carpenter,,2001-08-24,John Carpenter's Ghosts of Mars,,-0.649910768734306,0.0,0.0,0.0,0.0,0.0,0.0,0.0,1.0,0.0,1.0,0.0
438,Buena Vista,"('Sci-Fi', 'Adventure')",79667100,PG-13,James Purefoy/Taylor Kitsch/Willem Dafoe/Thomas Haden Church/Mark Strong,262026235.23307005,Andrew Stanton,Colin Wilson,2012-03-09,John Carter,Mark Andrews/Michael Chabon/Andrew Stanton,-0.6959575443690331,0.0,1.0,0.0,0.0,0.0,0.0,0.0,0.0,0.0,1.0,0.0
439,New Line,"('Drama', 'Thriller')",106955900,PG-13,Denzel Washington/Robert Duvall,48193543.268606916,Nick Cassavetes,Michael De Luca,2002-02-15,John Q.,,1.2192993655577644,0.0,0.0,0.0,0.0,0.0,1.0,0.0,0.0,0.0,0.0,1.0
440,Fox,"('Comedy',)",54223100,PG-13,Penn Badgley,21633069.53355097,Betty Thomas,,2006-07-28,John Tucker Must Die,,1.5064912732751488,0.0,0.0,0.0,1.0,0.0,0.0,0.0,0.0,0.0,0.0,0.0
441,Lionsgate/Summit,"('Action',)",44912500,R,Keanu Reeves/Adrianne Palicki/Willem Dafoe/Michael Nyqvist/Bridget Moynahan/Lance Reddick,20299109.600000005,David Leitch/Chad Stahelski,David Leitch/Keanu Reeves/Chad Stahelski/Mike Witherill,2014-10-24,John Wick,Derek Kolstad,1.2125354700286946,1.0,0.0,0.0,0.0,0.0,0.0,0.0,0.0,0.0,0.0,0.0
442,Universal,"('Action', 'Comedy')",9059100,PG,Rosamund Pike/Gillian Anderson,48560798.12327441,Oliver Parker,Tim Bevan/Eric Fellner,2011-10-21,Johnny English Reborn,,-0.8134482885350659,1.0,0.0,0.0,1.0,0.0,0.0,0.0,0.0,0.0,0.0,0.0
443,Warner Bros. (New Line),"('Adventure',)",113397000,PG,Dwayne Johnson/Michael Caine/Josh Hutcherson/Vanessa Hudgens,82800290.33365014,Brad Peyton,Beau Flynn/Charlotte Huggins/Tripp Vinson,2012-02-10,Journey 2: The Mysterious Island,Brian Gunn/Mark Gunn,0.36952418334595283,0.0,1.0,0.0,0.0,0.0,0.0,0.0,0.0,0.0,0.0,0.0
444,Fox,"('Comedy', 'Drama')",56583500,PG-13,Bradley Cooper/Robert DeNiro/Jennifer Lawrence/Virginia Madsen/Edgar Ramirez/Elisabeth Rohm,60438000.00000001,David O. Russell,,2015-12-25,Joy,David O. Russell,-0.06377610112842924,0.0,0.0,0.0,1.0,0.0,1.0,0.0,0.0,0.0,0.0,0.0
445,Fox,"('Thriller',)",33622400,R,Paul Walker,31267569.259811595,John Dahl,J.J. Abrams/Arnon Milchan/Chris Moore,2001-10-05,Joy Ride,J.J. Abrams,0.07531224191498254,0.0,0.0,0.0,0.0,0.0,0.0,0.0,0.0,0.0,0.0,1.0
446,Warner Bros.,"('Drama',)",49167500,R,"Robert Downey, Jr./Robert Duvall/Vera Farmiga/Billy Bob Thornton/Leighton Meester",50747774.000000015,David Dobkin,"David Dobkin/Susan Downey/Robert Downey, Jr.",2014-10-10,The Judge,Bill Dubuque/Nick Schenk,-0.031139769795617278,0.0,0.0,0.0,0.0,0.0,1.0,0.0,0.0,0.0,0.0,0.0
447,Sony / Columbia,"('Comedy', 'Drama')",109156700,PG-13,Meryl Streep/Amy Adams/Stanley Tucci/Chris Messina,45004334.764187455,Nora Ephron,Nora Ephron/Laurence Mark/Scott Rudin,2009-08-07,Julie & Julia,Nora Ephron,1.4254708034671868,0.0,0.0,0.0,1.0,0.0,1.0,0.0,0.0,0.0,0.0,0.0
448,Fox,"('Fantasy',)",96697900,PG-13,Hayden Christensen/Jamie Bell/Rachel Bilson/Samuel L. Jackson,95720282.16413485,Doug Liman,Simon Kinberg/Arnon Milchan,2008-02-14,Jumper,David S. Goyer/Simon Kinberg,0.010213277831638612,0.0,0.0,0.0,0.0,0.0,0.0,1.0,0.0,0.0,0.0,0.0
449,TriStar,"('Comedy',)",40071700,PG-13,Angela Bassett/Paula Patton,7122250.391413581,Salim Akil,Elizabeth Hunter/T.D. Jakes,2011-05-06,Jumping the Broom,Arlene Gibbs/Elizabeth Hunter,4.626269479139558,0.0,0.0,0.0,1.0,0.0,0.0,0.0,0.0,0.0,0.0,0.0
450,Fox Searchlight,"('Comedy', 'Drama')",173882600,PG-13,Ellen Page/Michael Cera/Jennifer Garner/Jason Bateman/Olivia Thirlby,8790500.265567489,Jason Reitman,Mason Novick,2007-12-05,Juno,Diablo Cody,18.78073997461789,0.0,0.0,0.0,1.0,0.0,1.0,0.0,0.0,0.0,0.0,0.0
451,Warner Bros.,"('Sci-Fi',)",50485000,PG-13,Channing Tatum/Mila Kunis/Eddie Redmayne/Sean Bean,177284800.0,Lilly &amp; Lana Wachowski,Lilly &amp; Lana Wachowski,2015-02-06,Jupiter Ascending,Lilly &amp; Lana Wachowski,-0.7152322139292258,0.0,0.0,0.0,0.0,0.0,0.0,0.0,0.0,0.0,1.0,0.0
452,Universal,"('Sci-Fi', 'Horror')",277199400,PG-13,William H. Macy/Tea Leoni,126429736.57228167,Joe Johnston,Larry J. Franco/Kathleen Kennedy/Steven Spielberg,2001-07-18,Jurassic Park III,Alexander Payne,1.1925174212596827,0.0,0.0,0.0,0.0,0.0,0.0,0.0,1.0,0.0,1.0,0.0
453,Universal,"('Sci-Fi', 'Horror')",684566100,PG-13,Omar Sy/Chris Pratt/Bryce Dallas Howard/Jake Johnson/Irrfan Khan,151095000.0,Colin Trevorrow,Patrick Crowley/Jon Jashni/Frank Marshall/Steven Spielberg/Thomas Tull,2015-06-12,Jurassic World,Derek Connolly/Rick Jaffa/Amanda Silver/Colin Trevorrow,3.5306998907971803,0.0,0.0,0.0,0.0,0.0,0.0,0.0,1.0,0.0,1.0,0.0
454,Sony / Columbia,"('Romance', 'Comedy')",113514400,PG-13,Adam Sandler/Jennifer Aniston/Nicole Kidman/Brooklyn Decker/Nick Swardson,86330307.77471006,Dennis Dugan,Jack Giarraputo/Tim Herlihy/Steve Koren/Heather Parry/Adam Sandler,2011-02-11,Just Go With It,Timothy Dowling/Allan Loeb,0.3148846902785323,0.0,0.0,0.0,1.0,0.0,0.0,0.0,0.0,1.0,0.0,0.0
455,DreamWorks,"('Romance', 'Comedy')",65278500,PG-13,Reese Witherspoon/Mark Ruffalo/Jon Heder,72090521.64848377,Mark S. Waters,,2005-09-16,Just Like Heaven,Leslie Dixon,-0.09449261141013032,0.0,0.0,0.0,1.0,0.0,0.0,0.0,0.0,1.0,0.0,0.0
456,Fox,"('Romance', 'Comedy')",80607200,PG-13,Ashton Kutcher/Brittany Murphy,23536600.541417714,Shawn Levy,Lauren Schuler Donner/Robert Simonds,2003-01-10,Just Married,Sam Harper,2.424759657120164,0.0,0.0,0.0,1.0,0.0,0.0,0.0,0.0,1.0,0.0,0.0
457,Paramount,"('Action', 'Thriller')",52420500,PG-13,Harrison Ford/Liam Neeson/Peter Sarsgaard,133870953.5239081,Kathryn Bigelow,Kathryn Bigelow,2002-07-19,K-19: The Widowmaker,,-0.6084251391349194,1.0,0.0,0.0,0.0,0.0,0.0,0.0,0.0,0.0,0.0,1.0
458,Universal,"('Drama',)",77014100,PG-13,Kevin Spacey/Jeff Bridges,92443248.2463995,Iain Softley,Lawrence Gordon/Lloyd Levin,2001-10-26,K-PAX,Charles Leavitt,-0.16690400368964153,0.0,0.0,0.0,0.0,0.0,1.0,0.0,0.0,0.0,0.0,0.0
459,Sony / Columbia,"('Action', 'Drama')",192362700,PG,Jaden Smith/Jackie Chan/Taraji P. Henson,43812631.19566535,Harald Zwart,James Lassiter/Will Smith,2010-06-11,The Karate Kid,,3.390576296157981,1.0,0.0,0.0,0.0,0.0,1.0,0.0,0.0,0.0,0.0,0.0
460,Lionsgate,"('Action', 'Comedy')",52364500,R,Aaron Johnson/Nicolas Cage/Christopher Mintz-Plasse/Chloe Moretz/Mark Strong/Clark Duke,32859473.396749012,Matthew Vaughn,Jeremy Kleiner/Mark Millar/Brad Pitt/Matthew Vaughn,2010-04-16,Kick-Ass,Jane Goldman/Matthew Vaughn,0.5935891414857775,1.0,0.0,0.0,1.0,0.0,0.0,0.0,0.0,0.0,0.0,0.0
461,Universal,"('Action', 'Comedy')",29758100,R,Aaron Johnson/Chloe Moretz/Christopher Mintz-Plasse/Jim Carrey/Morris Chestnut/John Leguizamo/Clark Duke,28845034.741600003,Jeff Wadlow,Mark Millar/Brad Pitt/Matthew Vaughn,2013-08-16,Kick-Ass 2,Jeff Wadlow,0.031654157000656546,1.0,0.0,0.0,1.0,0.0,0.0,0.0,0.0,0.0,0.0,0.0
462,Focus Features,"('Comedy',)",22670000,R,Mia Wasikowska/Julianne Moore/Mark Ruffalo/Josh Hutcherson/Annette Bening,4381263.119566535,Lisa Cholodenko,Steven Saxton,2010-07-09,The Kids Are All Right,Stuart Blumberg/Lisa Cholodenko,4.174306902216565,0.0,0.0,0.0,1.0,0.0,0.0,0.0,0.0,0.0,0.0,0.0
463,Miramax,"('Action',)",100649700,R,Uma Thurman/Lucy Liu,39227667.569029525,Quentin Tarantino,Lawrence Bender,2003-10-10,Kill Bill Vol. 1,Quentin Tarantino,1.565783444118496,1.0,0.0,0.0,0.0,0.0,0.0,0.0,0.0,0.0,0.0,0.0
464,Miramax,"('Action',)",92329000,R,Uma Thurman,38503796.200460866,Quentin Tarantino,Lawrence Bender,2004-04-16,Kill Bill Vol. 2,Quentin Tarantino,1.3979194030456372,1.0,0.0,0.0,0.0,0.0,0.0,0.0,0.0,0.0,0.0,0.0
465,Open Road Films,"('Action', 'Thriller')",27403300,R,Jason Statham/Robert DeNiro/Clive Owen,75539019.3028713,Gary McKendry,,2011-09-23,Killer Elite,Gary McKendry/Matt Sherring,-0.6372298680483613,1.0,0.0,0.0,0.0,0.0,0.0,0.0,0.0,0.0,0.0,1.0
466,IFC,"('Crime', 'Drama')",236700,R,Casey Affleck/Jessica Alba/Kate Hudson,14239105.13859124,Michael Winterbottom,,2010-06-18,The Killer Inside Me,John Curran,-0.9833767643615126,0.0,0.0,0.0,0.0,1.0,1.0,0.0,0.0,0.0,0.0,0.0
467,Lionsgate,"('Action', 'Comedy')",51262800,PG-13,Katherine Heigl/Ashton Kutcher/Rob Riggle,82148683.49187253,Robert Luketic,Scott Aversano,2010-06-04,Killers,Ted Griffin,-0.37597539216715825,1.0,0.0,0.0,1.0,0.0,0.0,0.0,0.0,0.0,0.0,0.0
468,Weinstein Company,"('Crime', 'Thriller')",16168200,R,Brad Pitt/James Gandolfini,15721574.113984203,Andrew Dominik,Megan Ellison/Dede Gardner/Brad Pitt,2012-11-30,Killing Them Softly,Andrew Dominik,0.028408471236892607,0.0,0.0,0.0,0.0,1.0,0.0,0.0,0.0,0.0,0.0,1.0
469,Buena Vista,"('Adventure',)",72351100,PG-13,Clive Owen/Keira Knightley/Ioan Gruffudd/Stellan Skarsgard/Ray Stevenson/Mads Mikkelsen,154015184.80184346,Antoine Fuqua,Jerry Bruckheimer,2004-07-07,King Arthur,David Franzoni,-0.5302339824927833,0.0,1.0,0.0,0.0,0.0,0.0,0.0,0.0,0.0,0.0,0.0
470,Universal,"('Adventure',)",292453400,PG-13,Naomi Watts/Jack Black/Adrien Brody/Andy Serkis/Jamie Bell,257288585.88338172,Peter Jackson,Peter Jackson/Fran Walsh,2005-12-14,King Kong,Philippa Boyens/Fran Walsh,0.13667459827602713,0.0,1.0,0.0,0.0,0.0,0.0,0.0,0.0,0.0,0.0,0.0
471,Weinstein Company,"('Drama',)",148927000,R,Colin Firth/Geoffrey Rush/Helena Bonham Carter/Guy Pearce,16429736.698374506,Tom Hooper,Iain Canning/Geoffrey Rush/Gareth Unwin,2010-11-26,The King's Speech,David Seidler,8.064478800487061,0.0,0.0,0.0,0.0,0.0,1.0,0.0,0.0,0.0,0.0,0.0
472,Universal,"('Thriller',)",59835500,R,Jamie Foxx/Jennifer Garner/Chris Cooper/Jason Bateman,82044669.14529656,Peter Berg,Ryan Kavanaugh/Michael Mann/Mary Parent/Scott Stuber,2007-09-28,The Kingdom,Matthew Michael Carnahan,-0.27069606565132653,0.0,0.0,0.0,0.0,0.0,0.0,0.0,0.0,0.0,0.0,1.0
473,Fox,"('Action', 'Adventure')",136085200,R,Sofia Boutella/Colin Firth/Samuel L. Jackson/Michael Caine/Taron Egerton/Mark Strong/Sophie Cookson/Mark Hamill,81591300.0,Matthew Vaughn,Matthew Vaughn,2015-02-13,Kingsman: The Secret Service,Jane Goldman/Matthew Vaughn,0.6678886106729516,1.0,1.0,0.0,0.0,0.0,0.0,0.0,0.0,0.0,0.0,0.0
474,Fox Searchlight,"('Drama',)",14124500,R,Liam Neeson/Laura Linney/Chris O'Donnell/Peter Sarsgaard,14118058.60683565,Bill Condon,,2004-11-12,Kinsey,Bill Condon,0.00045625204879318204,0.0,0.0,0.0,0.0,0.0,1.0,0.0,0.0,0.0,0.0,0.0
475,Warner Bros.,"('Action', 'Comedy')",5732000,R,"Robert Downey, Jr./Val Kilmer/Michelle Monaghan",18644100.426332008,Shane Black,Susan Downey/Joel Silver,2005-10-21,"Kiss Kiss, Bang Bang",Shane Black,-0.6925569017047126,1.0,0.0,0.0,1.0,0.0,0.0,0.0,0.0,0.0,0.0,0.0
476,Fox,"('Comedy',)",83248200,PG-13,Gal Gadot/Tom Cruise/Cameron Diaz/Peter Sarsgaard/Paul Dano/Viola Davis,128151946.24732114,James Mangold,Todd Garner/Arnon Milchan/Steve Pink/Joe Roth,2010-06-23,Knight & Day,,-0.3503945711496348,0.0,0.0,0.0,1.0,0.0,0.0,0.0,0.0,0.0,0.0,0.0
477,Sony / Columbia,"('Action',)",86553700,PG-13,James Purefoy/Heath Ledger/Rufus Sewell/Paul Bettany,88364869.64729364,Brian Helgeland,Todd Black/Brian Helgeland,2001-05-11,A Knight's Tale,Brian Helgeland,-0.020496489776116733,1.0,0.0,0.0,0.0,0.0,0.0,0.0,0.0,0.0,0.0,0.0
478,Universal,"('Romance', 'Comedy')",187258600,R,Seth Rogen/Katherine Heigl/Paul Rudd/Leslie Mann/Jay Baruchel/Jonah Hill/Jason Segel/Kristen Wiig,35162001.062269956,Judd Apatow,Judd Apatow/Evan Goldberg/Seth Rogen,2007-06-01,Knocked Up,Judd Apatow,4.325595652772304,0.0,0.0,0.0,1.0,0.0,0.0,0.0,0.0,1.0,0.0,0.0
479,Summit Entertainment,"('Drama', 'Thriller')",96439200,PG-13,Liam Hemsworth/Nicolas Cage/Rose Byrne,56255418.45523432,Alex Proyas,Todd Black/David Bloomfield/Jason Blumenthal/Stephen Jones/Steve Tisch,2009-03-20,Knowing,Juliet Snowden/Stiles White,0.7143095304986884,0.0,0.0,0.0,0.0,0.0,1.0,0.0,0.0,0.0,0.0,1.0
480,Universal,"('Horror', 'Comedy')",42546600,PG-13,Toni Collette/Adam Scott,15109500.000000002,Michael Dougherty,Jon Jashni/Thomas Tull,2015-12-04,Krampus,Michael Dougherty,1.8158840464608357,0.0,0.0,0.0,1.0,0.0,0.0,0.0,1.0,0.0,0.0,0.0
481,Paramount (DreamWorks),"('Animation',)",177713800,PG,Jack Black/Angelina Jolie/Dustin Hoffman/Jackie Chan/Seth Rogen/Lucy Liu/Gary Oldman/Michelle Yeoh,161869327.07758138,Jennifer Yuh Nelson,,2011-05-26,Kung Fu Panda 2,Jonathan Aibel/Glenn Berger,0.09788434417117586,0.0,0.0,1.0,0.0,0.0,0.0,0.0,0.0,0.0,0.0,0.0
482,Paramount,"('Drama',)",14547400,PG-13,Kate Winslet/Josh Brolin,18269198.640000004,Jason Reitman,Steven M. Rales/Jason Reitman,2014-01-31,Labor Day,Jason Reitman,-0.20371986277773613,0.0,0.0,0.0,0.0,0.0,1.0,0.0,0.0,0.0,0.0,0.0
483,Warner Bros.,"('Fantasy', 'Drama')",55906800,PG-13,Paul Giamatti/Bryce Dallas Howard/Jeffrey Wright/M. Night Shyamalan,84128603.7415871,M. Night Shyamalan,Sam Mercer/M. Night Shyamalan,2006-07-21,Lady in the Water,M. Night Shyamalan,-0.3354602654321277,0.0,0.0,0.0,0.0,0.0,1.0,1.0,0.0,0.0,0.0,0.0
484,Buena Vista,"('Crime', 'Comedy')",55501000,R,Tom Hanks/Marlon Wayans,44921095.56720434,Ethan Coen/Joel Coen,Ethan Coen/Joel Coen/Barry Sonnenfeld,2004-03-26,The Ladykillers,Ethan Coen/Joel Coen,0.23552195909753726,0.0,0.0,0.0,1.0,1.0,0.0,0.0,0.0,0.0,0.0,0.0
485,Sony / Screen Gems,"('Drama', 'Thriller')",47356800,PG-13,Samuel L. Jackson/Patrick Wilson,22522419.33273761,Neil LaBute,James Lassiter/Will Smith,2008-09-19,Lakeview Terrace,,1.1026515535639732,0.0,0.0,0.0,0.0,0.0,1.0,0.0,0.0,0.0,0.0,1.0
