,Dist,Genre,Gross,MPAA,actors,budget,directors,producers,rel_date,title,writers,ROI,Action,Adventure,Animation,Comedy,Crime,Drama,Fantasy,Horror,Romance,Sci-Fi,Thriller
678,Warner Bros.,"('Crime', 'Comedy')",173857600,PG-13,George Clooney/Brad Pitt/Matt Damon/Catherine Zeta-Jones/Don Cheadle/Bernie Mac/Julia Roberts/Casey Affleck,141180586.0683565,Steven Soderbergh,,2004-12-10,Ocean's Twelve,George Nolfi,0.23145543478493558,0.0,0.0,0.0,1.0,1.0,0.0,0.0,0.0,0.0,0.0,0.0
679,Relativity,"('Horror',)",28792400,R,Karen Gillan/Brenton Thwaites/Katee Sackhoff,5074777.400000001,Mike Flanagan,Marc D. Evans/Trevor Macy,2014-04-11,Oculus,Mike Flanagan/Jeff Howard,4.67362816741479,0.0,0.0,0.0,0.0,0.0,0.0,0.0,1.0,0.0,0.0,0.0
680,DreamWorks,"('Comedy',)",108551700,R,Luke Wilson/Will Ferrell/Vince Vaughn,31382134.05522362,Todd Phillips,Joe Medjuck/Todd Phillips/Tom Pollock/Ivan Reitman,2003-02-21,Old School,Todd Phillips,2.459028624662042,0.0,0.0,0.0,1.0,0.0,0.0,0.0,0.0,0.0,0.0,0.0
681,FilmDistrict,"('Thriller',)",2275600,R,Josh Brolin/Elizabeth Olsen/Sharlto Copley/Samuel L. Jackson,30905394.366000004,Spike Lee,Doug Davison/Roy Lee/Peter Schlessel,2013-11-27,Oldboy,Mark Protosevich,-0.9263688412109874,0.0,0.0,0.0,0.0,0.0,0.0,0.0,0.0,0.0,0.0,1.0
682,Sony / Columbia,"('Drama',)",2810600,PG-13,Ben Kingsley/Mark Strong,74576401.70532803,Roman Polanski,Roman Polanski,2005-09-23,Oliver Twist,,-0.9623124750493399,0.0,0.0,0.0,0.0,0.0,1.0,0.0,0.0,0.0,0.0,0.0
683,FilmDistrict,"('Thriller',)",104564200,R,Gerard Butler/Aaron Eckhart/Morgan Freeman/Angela Bassett/Ashley Judd/Melissa Leo/Radha Mitchell,72112586.854,Antoine Fuqua,Peter Schlessel,2013-03-22,Olympus Has Fallen,Katrin Benedikt/Creighton Rothenberger,0.4500131608328226,0.0,0.0,0.0,0.0,0.0,0.0,0.0,0.0,0.0,0.0,1.0
684,Fox,"('Horror',)",72198500,R,Liev Schreiber/Julia Stiles,30045929.90770968,John Moore,Glenn Williamson,2006-06-06,The Omen,David Seltzer,1.4029377763233786,0.0,0.0,0.0,0.0,0.0,0.0,0.0,1.0,0.0,0.0,0.0
685,Sony / Columbia,"('Action',)",80941200,R,Antonio Banderas/Salma Hayek/Johnny Depp/Mickey Rourke/Eva Mendes/Willem Dafoe,37920078.650061876,Robert Rodriguez,Robert Rodriguez,2003-09-12,Once Upon a Time in Mexico,Robert Rodriguez,1.1345208892352319,1.0,0.0,0.0,0.0,0.0,0.0,0.0,0.0,0.0,0.0,0.0
686,Magnolia,"('Drama',)",599600,PG-13,Colin Farrell,13143789.358699605,Neil Jordan,,2010-06-04,Ondine,Neil Jordan,-0.9543814965656661,0.0,0.0,0.0,0.0,0.0,1.0,0.0,0.0,0.0,0.0,0.0
687,Focus Features,"('Romance',)",14874300,PG-13,Anne Hathaway/Jim Sturgess/Romola Garai,16186932.707758138,Lone Scherfig,Nina Jacobson,2011-08-19,One Day,David Nicholls,-0.08109212112366504,0.0,0.0,0.0,0.0,0.0,0.0,0.0,0.0,1.0,0.0,0.0
688,Lionsgate,"('Action', 'Comedy')",28880400,PG-13,Katherine Heigl/Jason O'Mara/John Leguizamo,41924197.63729121,Julie Anne Robinson,Katherine Heigl/Sidney Kimmel/Gary Lucchesi/Tom Rosenberg,2012-01-27,One For the Money,Liz Brixius/Karen Ray/Stacy Sherman,-0.31112814012900425,1.0,0.0,0.0,1.0,0.0,0.0,0.0,0.0,0.0,0.0,0.0
689,Fox Searchlight,"('Thriller',)",47095600,R,Robin Williams,16064514.422868973,Mark Romanek,,2002-08-21,One Hour Photo,Mark Romanek,1.931654126623092,0.0,0.0,0.0,0.0,0.0,0.0,0.0,0.0,0.0,0.0,1.0
690,USA Films,"('Crime', 'Comedy')",9625000,R,Liv Tyler/Matt Dillon/Michael Douglas,24470271.594635163,Harald Zwart,Michael Douglas/Allison Lyon Segan,2001-04-27,One Night at McCool's,,-0.6066655834702638,0.0,0.0,0.0,1.0,1.0,0.0,0.0,0.0,0.0,0.0,0.0
691,Sony Classics,"('Drama',)",1959400,R,Tom Hiddleston/Tilda Swinton/Mia Wasikowska/Anton Yelchin/Jeffrey Wright,7104688.360000001,Jim Jarmusch,,2014-04-11,Only Lovers Left Alive,Jim Jarmusch,-0.7242102818989797,0.0,0.0,0.0,0.0,0.0,1.0,0.0,0.0,0.0,0.0,0.0
692,Sony / Columbia,"('Drama',)",32342300,PG-13,Benedict Cumberbatch/Eddie Redmayne/Mark Rylance/Natalie Portman/Scarlett Johansson/Eric Bana/Jim Sturgess,39414233.83229082,Justin Chadwick,Scott Rudin,2008-02-29,The Other Boleyn Girl,Peter Morgan,-0.17942588615022148,0.0,0.0,0.0,0.0,0.0,1.0,0.0,0.0,0.0,0.0,0.0
693,Sony / Columbia,"('Action', 'Comedy')",129867300,PG-13,Will Ferrell/Mark Wahlberg/Dwayne Johnson/Eva Mendes/Samuel L. Jackson/Michael Keaton/Steve Coogan/Rob Riggle/Ray Stevenson,109531577.98916337,Adam McKay,Patrick Crowley/Chris Henchy/Adam McKay,2010-08-06,The Other Guys,Chris Henchy/Adam McKay,0.18566081475470542,1.0,0.0,0.0,1.0,0.0,0.0,0.0,0.0,0.0,0.0,0.0
694,Fox,"('Comedy',)",87256900,PG-13,Cameron Diaz/Leslie Mann/Kate Upton/Nicki Minaj,40598219.20000001,Nick Cassavetes,Julie Yorn,2014-04-25,The Other Woman,Melissa Stack,1.1492790008878018,0.0,0.0,0.0,1.0,0.0,0.0,0.0,0.0,0.0,0.0,0.0
695,Miramax,"('Horror',)",147683100,PG-13,Nicole Kidman,23110812.061599877,Alejandro Amenabar,Tom Cruise/Paula Wagner,2001-08-10,The Others,Alejandro Amenabar,5.39021682173536,0.0,0.0,0.0,0.0,0.0,0.0,0.0,1.0,0.0,0.0,0.0
696,Warner Bros.,"('Comedy', 'Drama')",6970100,R,Sandra Bullock/Zoe Kazan/Anthony Mackie/Billy Bob Thornton,28204400.000000004,David Gordon Green,Sandra Bullock/George Clooney/Grant Heslov,2015-10-30,Our Brand Is Crisis,Peter Straughan,-0.7528718923288565,0.0,0.0,0.0,1.0,0.0,1.0,0.0,0.0,0.0,0.0,0.0
697,Weinstein Company,"('Comedy',)",27066500,R,Paul Rudd/Elizabeth Banks/Zooey Deschanel/Steve Coogan/Rashida Jones/Adam Scott,5395644.235919379,Jesse Peretz,,2011-08-26,Our Idiot Brother,,4.016361126965234,0.0,0.0,0.0,1.0,0.0,0.0,0.0,0.0,0.0,0.0,0.0
698,Relativity,"('Thriller',)",11764200,R,Christian Bale/Casey Affleck/Zoe Saldana/Woody Harrelson/Forest Whitaker/Willem Dafoe,22663955.868400004,Scott Cooper,Riza Aziz/Leonardo DiCaprio/Ryan Kavanaugh/Joey McFarland/Ridley Scott/Tony Scott/Tucker Tooley,2013-12-04,Out of the Furnace,Scott Cooper/Brad Ingelsby,-0.4809290986838428,0.0,0.0,0.0,0.0,0.0,0.0,0.0,0.0,0.0,0.0,1.0
699,MGM,"('Crime', 'Thriller')",59007500,PG-13,Denzel Washington/Eva Mendes/Sanaa Lathan,65379445.94838254,Carl Franklin,Neal H. Moritz,2003-10-03,Out of Time,,-0.09746099643324035,0.0,0.0,0.0,0.0,1.0,0.0,0.0,0.0,0.0,0.0,1.0
700,Buena Vista,"('Adventure',)",253451100,PG,Tony Cox/James Franco/Mila Kunis/Michelle Williams/Rachel Weisz/Zach Braff/Joey King,221488659.62300003,Sam Raimi,Palak Patel/Joe Roth,2013-03-08,Oz The Great and Powerful,Mitchell Kapner/David Lindsay-Abaire,0.14430734481577456,0.0,1.0,0.0,0.0,0.0,0.0,0.0,0.0,0.0,0.0,0.0
701,Warner Bros.,"('Romance',)",65516000,PG-13,Hilary Swank/Gerard Butler/Lisa Kudrow/Kathy Bates/Jeffrey Dean Morgan,35162001.062269956,Richard LaGravenese,Broderick Johnson/Andrew A. Kosove/Molly Smith,2007-12-21,P.S. I Love You,Richard LaGravenese/Steven Rogers,0.8632614191659569,0.0,0.0,0.0,0.0,0.0,0.0,0.0,0.0,1.0,0.0,0.0
702,Warner Bros.,"('Sci-Fi', 'Action')",112431100,PG-13,Idris Elba/Charlie Day/Ron Perlman,195734164.31800002,Guillermo del Toro,Jon Jashni/Mary Parent/Thomas Tull,2013-07-12,Pacific Rim,Travis Beachem/Guillermo del Toro,-0.42559286779727157,1.0,0.0,0.0,0.0,0.0,0.0,0.0,0.0,0.0,1.0,0.0
703,Buena Vista,"('Comedy',)",152781900,PG,Vin Diesel/Max Thieriot,69604641.5916395,Adam Shankman,Gary Barber/Roger Birnbaum/Jennifer Gibgot/Jonathan Glickman/Adam Shankman/George Zakk,2005-03-04,The Pacifier,Thomas Lennon &amp; Ben Garant,1.1949958581260947,0.0,0.0,0.0,1.0,0.0,0.0,0.0,0.0,0.0,0.0,0.0
704,Paramount,"('Action',)",51541800,R,Mark Wahlberg/Dwayne Johnson/Ed Harris/Anthony Mackie/Rebel Wilson,26784675.117200002,Michael Bay,Michael Bay/Ian Bryce,2013-04-26,Pain and Gain,Christopher Markus/Stephen McFeely,0.9243018544922355,1.0,0.0,0.0,0.0,0.0,0.0,0.0,0.0,0.0,0.0,0.0
705,Warner Bros.,"('Fantasy',)",34927400,PG,Hugh Jackman/Garrett Hedlund/Amanda Seyfried/Rooney Mara,151095000.0,Joe Wright,Greg Berlanti,2015-10-09,Pan,,-0.7688381481849168,0.0,0.0,0.0,0.0,0.0,0.0,1.0,0.0,0.0,0.0,0.0
706,Overture Films,"('Sci-Fi', 'Horror')",11756300,R,Dennis Quaid/Ben Foster/Cam Gigandet,37128576.18045465,Christian Alvart,Paul W.S. Anderson/Jeremy Bolt/Robert Kulzer,2009-09-25,Pandorum,Christian Alvart,-0.6833624876197437,0.0,0.0,0.0,0.0,0.0,0.0,0.0,1.0,0.0,1.0,0.0
707,Sony / Columbia,"('Thriller',)",143683500,R,Jodie Foster/Kristen Stewart/Forest Whitaker/Jared Leto,64258057.69147589,David Fincher,Cean Chaffin/Gavin Polone,2002-03-29,Panic Room,David Koepp,1.2360386410973052,0.0,0.0,0.0,0.0,0.0,0.0,0.0,0.0,0.0,0.0,1.0
708,Fox,"('Drama',)",33586700,PG-13,Cara Delevigne,12087600.000000002,Jake Schreier,Marty Bowen/Wyck Godfrey/Scott Neustadter/Michael H. Weber,2015-07-24,Paper Towns,Scott Neustadter/Michael H. Weber,1.7786078295112344,0.0,0.0,0.0,0.0,0.0,1.0,0.0,0.0,0.0,0.0,0.0
709,Relativity,"('Thriller',)",8155500,PG-13,Liam Hemsworth/Gary Oldman/Harrison Ford/Amber Heard,36056293.427,Robert Luketic,Ryan Kavanaugh/Tucker Tooley,2013-08-16,Paranoia,Jason Dean Hall/Barry Levy,-0.7738120248962439,0.0,0.0,0.0,0.0,0.0,0.0,0.0,0.0,0.0,0.0,1.0
710,Paramount,"('Horror',)",115055000,R,Dustin Ingram,5395644.235919379,Henry Joost/Ariel Schulman,Jason Blum/Akiva Goldsman/Oren Peli/Steven Schneider,2011-10-21,Paranormal Activity 3,Christopher B. Landon,20.323681653076125,0.0,0.0,0.0,0.0,0.0,0.0,0.0,1.0,0.0,0.0,0.0
711,Focus Features,"('Animation',)",62231500,PG,Kodi Smit-McPhee/Anna Kendrick/Casey Affleck/Christopher Mintz-Plasse/Leslie Mann,62886296.45593681,Sam Fell,Travis Knight,2012-08-17,ParaNorman,,-0.010412387003830181,0.0,0.0,1.0,0.0,0.0,0.0,0.0,0.0,0.0,0.0,0.0
712,Fox,"('Comedy',)",84027300,PG,Billy Crystal/Bette Midler/Marisa Tomei,26202623.523307007,Andy Fickman,Peter Chernin/Billy Crystal,2012-12-25,Parental Guidance,Lisa Addario/Joe Syracuse,2.206827740941988,0.0,0.0,0.0,1.0,0.0,0.0,0.0,0.0,0.0,0.0,0.0
713,FilmDistrict,"('Action', 'Crime')",19213000,R,Jason Statham/Jennifer Lopez,36056293.427,Taylor Hackford,Taylor Hackford/Sidney Kimmel/Peter Schlessel,2013-01-25,Parker,John J. McLaughlin,-0.46713879398338964,1.0,0.0,0.0,0.0,1.0,0.0,0.0,0.0,0.0,0.0,0.0
714,Newmarket,"('Drama',)",516357200,R,Monica Bellucci/James Caviezel,38503796.200460866,Mel Gibson,,2004-02-25,The Passion of the Christ,,12.410553009155485,0.0,0.0,0.0,0.0,0.0,1.0,0.0,0.0,0.0,0.0,0.0
715,Fox,"('Adventure',)",12879300,R,Karl Urban,52743001.593404934,Marcus Nispel,Brad Fischer/Marcus Nispel,2007-04-13,Pathfinder: Legend of the Ghost Warrior,Laeta Kalogridis,-0.7558102570785344,0.0,1.0,0.0,0.0,0.0,0.0,0.0,0.0,0.0,0.0,0.0
716,Universal,"('Sci-Fi', 'Comedy')",41220900,R,Jesse Plemons/Simon Pegg/Nick Frost/Seth Rogen/Jason Bateman/Kristen Wiig/Sigourney Weaver,43165153.88735503,Greg Mottola,Tim Bevan/Eric Fellner,2011-03-18,Paul,Nick Frost/Simon Pegg,-0.04504220910294465,0.0,0.0,0.0,1.0,0.0,0.0,0.0,0.0,0.0,1.0,0.0
717,Sony / Columbia,"('Comedy',)",169875500,PG,Kevin James,29252817.596721847,Steve Carr,Todd Garner/Jack Giarraputo/Adam Sandler,2009-01-16,Paul Blart: Mall Cop,Nick Bakay/Kevin James,4.807150010022855,0.0,0.0,0.0,1.0,0.0,0.0,0.0,0.0,0.0,0.0,0.0
718,Sony / Columbia,"('Comedy',)",71630900,PG,Kevin James,30219000.000000004,Andy Fickman,Todd Garner/Kevin James/Adam Sandler,2015-04-17,Paul Blart: Mall Cop 2,Nick Bakay/Kevin James,1.3703927992322709,0.0,0.0,0.0,1.0,0.0,0.0,0.0,0.0,0.0,0.0,0.0
719,Warner Bros.,"('Drama',)",53811700,PG-13,Kevin Spacey/Helen Hunt/James Caviezel,56221808.44820732,Mimi Leder,,2000-10-20,Pay It Forward,Leslie Dixon,-0.0428678570599087,0.0,0.0,0.0,0.0,0.0,1.0,0.0,0.0,0.0,0.0,0.0
720,Paramount,"('Sci-Fi', 'Action')",75226600,PG-13,Ben Affleck/Aaron Eckhart/Uma Thurman/Paul Giamatti,78455335.13805905,John Woo,John Davis,2003-12-25,Paycheck,,-0.04115379957752263,1.0,0.0,0.0,0.0,0.0,0.0,0.0,0.0,0.0,1.0,0.0
721,Fox,"('Animation',)",87318500,PG,Benedict Cumberbatch/John Malkovich,133974123.36000003,Eric Darnell/Simon J. Smith,Lara Breay/Eric Darnell/Tom McGrath/Mireille Soria/Mark Swift,2014-11-26,Penguins of Madagascar,,-0.34824354278200687,0.0,0.0,1.0,0.0,0.0,0.0,0.0,0.0,0.0,0.0,0.0
722,Buena Vista,"('Drama',)",13841300,PG-13,Chris Pine/Elizabeth Banks/Michelle Pfeiffer/Olivia Wilde,16769679.054916484,Alex Kurtzman,Bobby Cohen/Alex Kurtzman/Roberto Orci/Clayton Townsend,2012-06-29,People Like Us,Alex Kurtzman/Jody Lambert/Roberto Orci,-0.17462344063513557,0.0,0.0,0.0,0.0,0.0,1.0,0.0,0.0,0.0,0.0,0.0
723,Fox,"('Fantasy',)",96696000,PG,Logan Lerman/Brandon T. Jackson/Sean Bean/Pierce Brosnan/Steve Coogan/Rosario Dawson,104054999.08970521,Chris Columbus,Chris Columbus/Thomas M. Hammel/Karen Rosenfelt,2010-02-12,Percy Jackson & The Olympians: The Lightning Thief,,-0.07072220608412161,0.0,0.0,0.0,0.0,0.0,0.0,1.0,0.0,0.0,0.0,0.0
724,Fox,"('Fantasy',)",75467600,PG,Logan Lerman/Brandon T. Jackson/Stanley Tucci/Sean Bean,92716183.098,Thor Freudenthal,Chris Columbus/Karen Rosenfelt,2013-08-07,Percy Jackson: Sea of Monsters,Marc Guggenheim,-0.18603638029154457,0.0,0.0,0.0,0.0,0.0,0.0,1.0,0.0,0.0,0.0,0.0
725,Universal,"('Thriller',)",18011200,R,Chris Hemsworth/Milla Jovovich/Timothy Olyphant,15751517.167465609,David Twohy,Mark Canton/Ryan Kavanaugh/Tucker Tooley,2009-08-07,A Perfect Getaway,David Twohy,0.14345810682933546,0.0,0.0,0.0,0.0,0.0,0.0,0.0,0.0,0.0,0.0,1.0
726,Warner Bros.,"('Action', 'Drama')",293409200,PG-13,George Clooney/Mark Wahlberg/Diane Lane/John C. Reilly,196776329.56872562,Wolfgang Petersen,Barry Levinson*,2000-06-30,The Perfect Storm,,0.49107974847922264,1.0,0.0,0.0,0.0,0.0,1.0,0.0,0.0,0.0,0.0,0.0
727,Paramount (DreamWorks),"('Thriller',)",2799800,R,Dustin Hoffman/Alan Rickman,72110231.77850322,Tom Tykwer,Bernd Eichinger,2006-12-27,Perfume - The Story of a Murderer,,-0.9611733323975441,0.0,0.0,0.0,0.0,0.0,0.0,0.0,0.0,0.0,0.0,1.0
728,Universal,"('Adventure',)",67727500,PG,Jeremy Sumpter,130758891.89676508,P.J. Hogan,Lucy Fisher/Gail Lyon/Douglas Wick,2003-12-25,Peter Pan,Michael Goldenberg,-0.4820428728206778,0.0,1.0,0.0,0.0,0.0,0.0,0.0,0.0,0.0,0.0,0.0
729,Weinstein Company,"('Drama',)",40256700,PG-13,Steve Coogan/Judi Dench,12362157.7464,Stephen Frears,Steve Coogan,2013-11-22,Philomena,Steve Coogan,2.2564460691923465,0.0,0.0,0.0,0.0,0.0,1.0,0.0,0.0,0.0,0.0,0.0
730,Fox,"('Thriller',)",66876200,R,Colin Farrell/Kiefer Sutherland/Radha Mitchell/Katie Holmes,16998655.94657946,Joel Schumacher,David Zucker,2003-04-04,Phone Booth,,2.934205163641606,0.0,0.0,0.0,0.0,0.0,0.0,0.0,0.0,0.0,0.0,1.0
731,Focus Features,"('Drama',)",46780900,R,Adrien Brody,46854833.73336784,Roman Polanski,Roman Polanski,2002-12-25,The Pianist,,-0.0015779318263845488,0.0,0.0,0.0,0.0,0.0,1.0,0.0,0.0,0.0,0.0,0.0
732,Sony / Columbia,"('Action', 'Comedy')",105344900,R,Seth Rogen/James Franco/Danny McBride/Amber Heard,30405266.099195775,David Gordon Green,Judd Apatow/Evan Goldberg/Shauna Robertson/Seth Rogen,2008-08-06,Pineapple Express,Seth Rogen/Evan Goldberg/Judd Apatow,2.4646925850383,1.0,0.0,0.0,1.0,0.0,0.0,0.0,0.0,0.0,0.0,0.0
733,Sony / Columbia,"('Comedy',)",108714700,PG,Steve Martin/Kevin Kline/Beyonce Knowles,96146975.70467097,Shawn Levy,Robert Simonds,2006-02-10,The Pink Panther,,0.13071367251251442,0.0,0.0,0.0,1.0,0.0,0.0,0.0,0.0,0.0,0.0,0.0
734,Sony / Columbia,"('Action', 'Comedy')",41701500,PG,Steve Martin/Alfred Molina,78757585.83732805,Harald Zwart,Robert Simonds,2009-02-06,The Pink Panther 2,Scott Neustadter/Michael H. Weber,-0.47050814779755346,1.0,0.0,0.0,1.0,0.0,0.0,0.0,0.0,0.0,0.0,0.0
735,Buena Vista,"('Adventure',)",389474000,PG-13,Johnny Depp/Orlando Bloom/Keira Knightley/Geoffrey Rush/Jack Davenport/Jonathan Pryce/Stellan Skarsgard/Naomie Harris,351620010.62269956,Gore Verbinski,Jerry Bruckheimer,2007-05-25,Pirates of the Caribbean: At World's End,Ted Elliott/Terry Rossio,0.10765595880127288,0.0,1.0,0.0,0.0,0.0,0.0,0.0,0.0,0.0,0.0,0.0
736,Buena Vista,"('Adventure',)",559681700,PG-13,Johnny Depp/Orlando Bloom/Keira Knightley/Jack Davenport/Jonathan Pryce/Stellan Skarsgard/Naomie Harris,270413369.1693871,Gore Verbinski,Jerry Bruckheimer,2006-07-07,Pirates of the Caribbean: Dead Man's Chest,Stuart Beattie/Ted Elliott/Terry Rossio,1.069726440372166,0.0,1.0,0.0,0.0,0.0,0.0,0.0,0.0,0.0,0.0,0.0
737,Buena Vista,"('Adventure',)",259172200,PG-13,Johnny Depp/Penelope Cruz/Geoffrey Rush,269782211.79596895,Rob Marshall,Jerry Bruckheimer/John DeLuca/Ted Elliott/Terry Rossio,2011-05-20,Pirates of the Caribbean: On Stranger Tides,Ted Elliott/Terry Rossio,-0.03932806290428481,0.0,1.0,0.0,0.0,0.0,0.0,0.0,0.0,0.0,0.0,0.0
738,Buena Vista,"('Adventure',)",438619400,PG-13,Johnny Depp/Geoffrey Rush/Orlando Bloom/Keira Knightley/Jack Davenport/Jonathan Pryce,183062448.65547112,Gore Verbinski,Jerry Bruckheimer,2003-07-09,Pirates of the Caribbean: The Curse of the Black Pearl,Ted Elliott/Terry Rossio,1.3960096853369124,0.0,1.0,0.0,0.0,0.0,0.0,0.0,0.0,0.0,0.0,0.0
739,Sony / Columbia,"('Animation',)",33197400,PG,Hugh Grant/Martin Freeman/Imelda Staunton/Salma Hayek/Anton Yelchin/Brendan Gleeson,57645771.75127541,Peter Lord,Peter Lord,2012-04-27,The Pirates! Band of Misfits,Gideon Defoe,-0.42411387702055514,0.0,0.0,1.0,0.0,0.0,0.0,0.0,0.0,0.0,0.0,0.0
740,USA Films,"('Sci-Fi', 'Horror')",63047100,R,Vin Diesel/Radha Mitchell,32327539.85771921,David Twohy,Ted Field/Scott Kroopf,2000-02-18,Pitch Black,David Twohy,0.9502597561547987,0.0,0.0,0.0,0.0,0.0,0.0,0.0,1.0,0.0,1.0,0.0
741,Universal,"('Comedy',)",69937900,PG-13,Anna Kendrick/Rebel Wilson/Adam DeVine/Elizabeth Banks,17817783.995848764,Jason Moore,Elizabeth Banks/Paul Brooks/Max Handelman/Scott Niemeyer,2012-09-28,Pitch Perfect,Kay Cannon,2.9251738609186373,0.0,0.0,0.0,1.0,0.0,0.0,0.0,0.0,0.0,0.0,0.0
742,Universal,"('Comedy',)",187631100,PG-13,Anna Kendrick/Rebel Wilson/Adam DeVine/Hailee Steinfeld/Elizabeth Banks,29211700.000000004,Elizabeth Banks,Elizabeth Banks/Max Handelman/Jason Moore,2015-05-15,Pitch Perfect 2,Kay Cannon,5.423148943745143,0.0,0.0,0.0,1.0,0.0,0.0,0.0,0.0,0.0,0.0,0.0
743,Sony / Columbia,"('Action', 'Comedy')",82536700,PG-13,Adam Sandler/Kevin James/Josh Gad/Michelle Monaghan/Brian Cox,88642400.0,Chris Columbus,Chris Columbus/Jack Giarraputo/Seth Gordon/Tim Herlihy/Heather Parry/Adam Sandler,2015-07-24,Pixels,Timothy Dowling/Tim Herlihy,-0.06888012959937906,1.0,0.0,0.0,1.0,0.0,0.0,0.0,0.0,0.0,0.0,0.0
744,Focus Features,"('Drama',)",22118700,R,Ryan Gosling/Bradley Cooper/Eva Mendes/Rose Byrne/Dane DeHaan,15452697.183000002,Derek Cianfrance,,2013-03-29,The Place Beyond the Pines,Derek Cianfrance,0.43138118466033726,0.0,0.0,0.0,0.0,0.0,1.0,0.0,0.0,0.0,0.0,0.0
745,Buena Vista,"('Animation',)",99505000,PG,Val Kilmer,51508990.61000001,Klay Hall,,2013-08-09,Planes,Jeffrey M. Howard,0.9317986786695447,0.0,0.0,1.0,0.0,0.0,0.0,0.0,0.0,0.0,0.0,0.0
746,Fox,"('Sci-Fi', 'Action')",275410900,PG-13,Mark Wahlberg/Helena Bonham Carter/Michael Clarke Duncan/Paul Giamatti,135945953.30352867,Tim Burton,Ralph Winter,2001-07-27,Planet of the Apes,,1.0258852382688124,1.0,0.0,0.0,0.0,0.0,0.0,0.0,0.0,0.0,1.0,0.0
747,Sony Classics,"('Comedy', 'Drama')",4393800,R,Rebecca Hall/Amanda Peet,3285947.339674901,Nicole Holofcener,,2010-04-30,Please Give,Nicole Holofcener,0.337148635021858,0.0,0.0,0.0,1.0,0.0,1.0,0.0,0.0,0.0,0.0,0.0
748,Warner Bros.,"('Animation',)",226416800,G,Tom Hanks,211770879.10253474,Robert Zemeckis,Gary Goetzman/Tom Hanks,2004-11-10,The Polar Express,,0.06915927704287439,0.0,0.0,1.0,0.0,0.0,0.0,0.0,0.0,0.0,0.0,0.0
749,Fox,"('Horror',)",48444800,PG-13,Sam Rockwell/Rosemarie DeWitt/Jared Harris,35255500.0,Gil Kenan,Roy Lee/Sam Raimi,2015-05-22,Poltergeist,David Lindsay-Abaire,0.3741061678319695,0.0,0.0,0.0,0.0,0.0,0.0,0.0,1.0,0.0,0.0,0.0
750,TriStar,"('Action', 'Drama')",25245100,PG-13,Emily Browning/Kiefer Sutherland/Jared Harris/Carrie-Anne Moss,101495548.00000003,Paul W.S. Anderson,Paul W.S. Anderson/Don Carmody/Peter Schlessel,2014-02-21,Pompeii,,-0.7512688930947001,1.0,0.0,0.0,0.0,0.0,1.0,0.0,0.0,0.0,0.0,0.0
751,Warner Bros.,"('Action', 'Drama')",80220400,PG-13,Josh Lucas/Kurt Russell/Emmy Rossum/Mike Vogel,192293951.40934193,Wolfgang Petersen,Akiva Goldsman/Jon Jashni,2006-05-12,Poseidon,Mark Protosevich,-0.5828241116683259,1.0,0.0,0.0,0.0,0.0,1.0,0.0,0.0,0.0,0.0,0.0
752,Lionsgate,"('Horror',)",54572300,PG-13,Jeffrey Dean Morgan/Matisyahu,14673469.173051924,Ole Bornedal,Sam Raimi/Peter Schlessel,2012-08-31,The Possession,Juliet Snowden/Stiles White,2.719113684460043,0.0,0.0,0.0,0.0,0.0,0.0,0.0,1.0,0.0,0.0,0.0
753,Lionsgate,"('Drama',)",53886300,R,Gabourey Sidibe/Mo'Nique/Paula Patton/Lenny Kravitz,11251083.691046864,Lee Daniels,Lee Daniels,2009-11-06,"Precious: Based on the Novel ""Push"" by Sapphire",Geoffrey Fletcher,3.7894319764842237,0.0,0.0,0.0,0.0,0.0,1.0,0.0,0.0,0.0,0.0,0.0
754,Fox,"('Sci-Fi', 'Horror')",56644800,R,Adrien Brody/Topher Grace/Laurence Fishburne,43812631.19566535,Nimrd Antal,John Davis/Robert Rodriguez/Alex Young,2010-07-09,Predators,Alex Litvak,0.2928874266196597,0.0,0.0,0.0,0.0,0.0,0.0,0.0,1.0,0.0,1.0,0.0
755,Sony / Columbia,"('Action', 'Thriller')",22568800,PG-13,Joseph Gordon-Levitt/Jamie Chung,36683672.93262981,David Koepp,Gavin Polone,2012-08-24,Premium Rush,David Koepp,-0.3847726196488561,1.0,0.0,0.0,0.0,0.0,0.0,0.0,0.0,0.0,0.0,1.0
756,Buena Vista,"('Fantasy', 'Drama')",70143500,PG-13,Andy Serkis/Christian Bale/Hugh Jackman/Michael Caine/Scarlett Johansson/Piper Perabo/Rebecca Hall,48073487.85233548,Christopher Nolan,Christopher Nolan/Aaron Ryder/Emma Thomas,2006-10-20,The Prestige,Christopher Nolan,0.4590890558108802,0.0,0.0,0.0,0.0,0.0,1.0,1.0,0.0,0.0,0.0,0.0
757,Warner Bros. (New Line),"('Crime', 'Drama')",18985300,R,Frank Grillo/Colin Farrell/Edward Norton/Jon Voight,33783628.999106415,Gavin O'Connor,,2008-10-24,Pride & Glory,Joe Carnahan/Gavin O'Connor,-0.4380325452750453,0.0,0.0,0.0,0.0,1.0,1.0,0.0,0.0,0.0,0.0,0.0
758,Sony / Screen Gems,"('Action', 'Horror')",32102200,PG-13,Paul Bettany/Cam Gigandet/Karl Urban/Christopher Plummer/Lily Collins,64747730.83103255,Scott Charles Stewart,Michael De Luca,2011-05-13,Priest,Cory Goodman,-0.5041957519133021,1.0,0.0,0.0,0.0,0.0,0.0,0.0,1.0,0.0,0.0,0.0
759,Paramount,"('Romance', 'Comedy')",39292800,PG,Julia Stiles,28236117.2136713,Martha Coolidge,,2004-04-02,The Prince and Me,Jack Amiel/Michael Begler/Katherine Fugate,0.39157943362606873,0.0,0.0,0.0,1.0,0.0,0.0,0.0,0.0,1.0,0.0,0.0
760,Buena Vista,"('Adventure',)",98865300,PG-13,Jake Gyllenhaal/Ben Kingsley/Alfred Molina/Gemma Arterton,219063155.97832674,Mike Newell,Jerry Bruckheimer,2010-05-28,Prince of Persia: The Sands of Time,Carlo Bernard/Doug Miro/Boaz Yakin,-0.5486904241908148,0.0,1.0,0.0,0.0,0.0,0.0,0.0,0.0,0.0,0.0,0.0
761,Buena Vista,"('Comedy',)",165619700,G,Anne Hathaway/Julie Andrews,35345947.85891745,Garry Marshall,Debra Martin Chase/Whitney Houston/Mario Iscovich,2001-08-03,The Princess Diaries,,3.6856771435601976,0.0,0.0,0.0,1.0,0.0,0.0,0.0,0.0,0.0,0.0,0.0
762,Buena Vista,"('Comedy',)",132717600,G,Anne Hathaway/Julie Andrews/Abigail Breslin/Chris Pine/Raven-Symone,51338394.93394782,Garry Marshall,Debra Martin Chase/Whitney Houston/Mario Iscovich,2004-08-11,The Princess Diaries 2: Royal Engagement,,1.5851528893872704,0.0,0.0,0.0,1.0,0.0,0.0,0.0,0.0,0.0,0.0,0.0
763,Warner Bros.,"('Action', 'Thriller')",65134800,R,Hugh Jackman/Jake Gyllenhaal/Viola Davis/Maria Bello/Terrence Howard/Melissa Leo/Paul Dano,47388271.361200005,Denis Villeneuve,Broderick Johnson/Andrew A. Kosove/Stephen Levinson,2013-09-20,Prisoners,Aaron Guzikowski,0.3744920025365239,1.0,0.0,0.0,0.0,0.0,0.0,0.0,0.0,0.0,0.0,1.0
764,Buena Vista,"('Comedy', 'Drama')",11161300,PG,Aimee Teegarden,8633030.777471006,Joe Nussbaum,,2011-04-29,Prom,,0.29285998019685455,0.0,0.0,0.0,1.0,0.0,1.0,0.0,0.0,0.0,0.0,0.0
765,Fox,"('Sci-Fi', 'Action')",135500600,R,Noomi Rapace/Michael Fassbender/Charlize Theron/Idris Elba/Guy Pearce,136253642.32119644,Ridley Scott,Damon Lindelof/Ridley Scott/Tony Scott,2012-06-08,Prometheus,Damon Lindelof/Jon Spaihts,-0.0055267683738043916,1.0,0.0,0.0,0.0,0.0,0.0,0.0,0.0,0.0,1.0,0.0
766,Miramax,"('Drama',)",10180300,PG-13,Gwyneth Paltrow/Anthony Hopkins/Jake Gyllenhaal,24858800.56844268,John Madden,James D. Stern,2005-09-16,Proof,,-0.5904750121804545,0.0,0.0,0.0,0.0,0.0,1.0,0.0,0.0,0.0,0.0,0.0
767,Warner Bros.,"('Romance', 'Thriller')",51853300,R,Russell Crowe/Meg Ryan,91360438.72833689,Taylor Hackford,Taylor Hackford,2000-12-08,Proof of Life,Tony Gilroy,-0.43243157846267133,0.0,0.0,0.0,0.0,0.0,0.0,0.0,0.0,1.0,0.0,1.0
768,Buena Vista,"('Romance', 'Comedy')",190297400,PG-13,Sandra Bullock/Ryan Reynolds/Craig T. Nelson,45004334.764187455,Anne Fletcher,,2009-06-19,The Proposal,,3.2284237951103014,0.0,0.0,0.0,1.0,0.0,0.0,0.0,0.0,1.0,0.0,0.0
769,Universal,"('Crime', 'Drama')",112724700,R,Johnny Depp/Christian Bale/Marion Cotillard/Giovanni Ribisi/Billy Crudup/Channing Tatum,112510836.91046864,Michael Mann,Kevin Misher,2009-07-01,Public Enemies,Ronan Bennett/Ann Biderman/Michael Mann,0.0019008221377070367,0.0,0.0,0.0,0.0,1.0,1.0,0.0,0.0,0.0,0.0,0.0
770,Universal,"('Thriller',)",66627300,R,Ethan Hawke/Lena Headey,3090539.4366,James DeMonaco,Michael Bay/Jason Blum/Andrew Form/Brad Fuller,2013-06-07,The Purge,James DeMonaco,20.55846944095261,0.0,0.0,0.0,0.0,0.0,0.0,0.0,0.0,0.0,0.0,1.0
771,Universal,"('Thriller',)",77128400,R,Michael K. Williams/Frank Grillo,9134599.320000002,James DeMonaco,Michael Bay/Jason Blum/Andrew Form/Brad Fuller,2014-07-18,The Purge: Anarchy,James DeMonaco,7.443544954525709,0.0,0.0,0.0,0.0,0.0,0.0,0.0,0.0,0.0,0.0,1.0
772,Sony / Columbia,"('Drama',)",210897500,PG-13,Will Smith/Thandie Newton/Jaden Smith,66101045.79696129,Gabriele Muccino,Todd Black/Jason Blumenthal/Louis D'Esposito/James Lassiter/Will Smith/Steve Tisch,2006-12-15,The Pursuit of Happyness,Steve Conrad,2.190531972032659,0.0,0.0,0.0,0.0,0.0,1.0,0.0,0.0,0.0,0.0,0.0
773,Paramount (DreamWorks),"('Animation',)",165025600,PG,Antonio Banderas/Salma Hayek/Zach Galifianakis/Billy Bob Thornton,140286750.13390386,Chris Miller,Andrew Adamson/Guillermo del Toro,2011-10-28,Puss in Boots,David H. Steinberg/Tom Wheeler/Jon Zack,0.17634487820469769,0.0,0.0,1.0,0.0,0.0,0.0,0.0,0.0,0.0,0.0,0.0
