,Dist,Genre,Gross,MPAA,actors,budget,directors,producers,rel_date,title,writers,ROI,Action,Adventure,Animation,Comedy,Crime,Drama,Fantasy,Horror,Romance,Sci-Fi,Thriller
967,Warner Bros.,"('Action',)",40096600,PG-13,Emily Browning/Abbie Cornish/Jena Malone/Vanessa Hudgens/Jamie Chung/Oscar Isaac/Carla Gugino,88488565.46907781,Zack Snyder,Jon Jashni/Deborah Snyder/Zack Snyder/Thomas Tull,2011-03-25,Sucker Punch,Zack Snyder,-0.5468725276825548,1.0,0.0,0.0,0.0,0.0,0.0,0.0,0.0,0.0,0.0,0.0
968,IFC,"('Comedy',)",352100,R,Ellen Page/Kevin Bacon/Liv Tyler,2697822.1179596893,James Gunn,Ted Hope,2011-04-01,Super,James Gunn,-0.8694873180644369,0.0,0.0,0.0,1.0,0.0,0.0,0.0,0.0,0.0,0.0,0.0
969,Fox Searchlight,"('Comedy',)",27563500,R,Brian Cox,4016128.605717243,Jay Chandrasekhar,,2002-02-15,Super Troopers,,5.863201532132564,0.0,0.0,0.0,1.0,0.0,0.0,0.0,0.0,0.0,0.0,0.0
970,Sony / Columbia,"('Comedy',)",152888300,R,Jonah Hill/Michael Cera/Christopher Mintz-Plasse/Seth Rogen/Emma Stone,23441334.041513305,Greg Mottola,Judd Apatow/Shauna Robertson/Seth Rogen/Evan Goldberg,2007-08-17,Superbad,Seth Rogen/Evan Goldberg,5.522167199581871,0.0,0.0,0.0,1.0,0.0,0.0,0.0,0.0,0.0,0.0,0.0
971,Warner Bros.,"('Action', 'Adventure')",264534800,PG-13,Brandon Routh/Kate Bosworth/Kevin Spacey/James Marsden/Parker Posey/Frank Langella/Kal Penn,324496043.00326455,Bryan Singer,Gilbert Adler/Scott Mednick/Jon Peters/Bryan Singer/Thomas Tull,2006-06-28,Superman Returns,Michael Dougherty/Dan Harris,-0.18478266313608427,1.0,1.0,0.0,0.0,0.0,0.0,0.0,0.0,0.0,0.0,0.0
972,MGM,"('Sci-Fi', 'Thriller')",22863800,PG-13,Angela Bassett,126499069.00846647,Walter Hill,,2000-01-14,Supernova,,-0.8192571678257193,0.0,0.0,0.0,0.0,0.0,0.0,0.0,0.0,0.0,1.0,1.0
973,Buena Vista,"('Romance', 'Comedy')",189510600,PG-13,Reese Witherspoon/Josh Lucas,40161286.05717243,Andy Tennant,Jon Jashni/Neal H. Moritz,2002-09-27,Sweet Home Alabama,,3.7187383324881145,0.0,0.0,0.0,1.0,0.0,0.0,0.0,0.0,1.0,0.0,0.0
974,Sony / Columbia,"('Romance', 'Comedy')",36843300,R,Frank Grillo/Cameron Diaz/Christina Applegate/Thomas Jane/Jason Bateman,57564510.015280485,Roger Kumble,Cathy Konrad,2002-04-12,The Sweetest Thing,,-0.3599650202838528,0.0,0.0,0.0,1.0,0.0,0.0,0.0,0.0,1.0,0.0,0.0
975,Sony / Screen Gems,"('Romance', 'Comedy')",892300,R,Madonna/Elizabeth Banks,13387095.352390809,Guy Ritchie,Matthew Vaughn,2002-10-11,Swept Away,,-0.9333462579811502,0.0,0.0,0.0,1.0,0.0,0.0,0.0,0.0,1.0,0.0,0.0
976,Buena Vista,"('Comedy', 'Drama')",19647700,PG-13,Kevin Costner/Kelsey Grammer/Paula Patton/Stanley Tucci,23648540.29937449,Joshua Michael Stern,Jim Wilson,2008-08-01,Swing Vote,Joshua Michael Stern,-0.16917916491785812,0.0,0.0,0.0,1.0,0.0,1.0,0.0,0.0,0.0,0.0,0.0
977,Miramax,"('Comedy',)",30260400,PG-13,Jason Bateman/Jennifer Aniston/Jeff Goldblum/Patrick Wilson,20810999.81794104,Josh Gordon/Will Speck,Jennifer Aniston/Albert Berger/Allan Loeb/Ron Yerxa,2010-08-20,The Switch,Allan Loeb,0.4540579628429331,0.0,0.0,0.0,1.0,0.0,0.0,0.0,0.0,0.0,0.0,0.0
978,Warner Bros.,"('Action',)",106755100,R,John Travolta/Hugh Jackman/Halle Berry/Don Cheadle,138664872.36959925,Dominic Sena,Joel Silver/Jim Van Wyck,2001-06-08,Swordfish,Skip Woods,-0.23012152843256872,1.0,0.0,0.0,0.0,0.0,0.0,0.0,0.0,0.0,0.0,0.0
979,Sony Classics,"('Comedy',)",3696400,R,Philip Seymour Hoffman/Michelle Williams,22522419.33273761,Charlie Kaufman,Spike Jonze/Sidney Kimmel,2008-10-24,"Synecdoche, New York",Charlie Kaufman,-0.8358790880592888,0.0,0.0,0.0,1.0,0.0,0.0,0.0,0.0,0.0,0.0,0.0
980,Warner Bros.,"('Drama', 'Thriller')",68168500,R,George Clooney/Matt Damon/Chris Cooper/Mark Strong/Jeffrey Wright/Amanda Peet,62147001.421106696,Stephen Gaghan,Jennifer Fox/Jeff Skoll/Steven Soderbergh,2005-11-23,Syriana,Stephen Gaghan,0.09689121665085287,0.0,0.0,0.0,0.0,0.0,1.0,0.0,0.0,0.0,0.0,1.0
981,Sony Classics,"('Drama',)",1912800,R,Jessica Chastain,5395644.235919379,Jeff Nichols,Brian Kavanaugh-Jones,2011-09-30,Take Shelter,Jeff Nichols,-0.6454918233366302,0.0,0.0,0.0,0.0,0.0,1.0,0.0,0.0,0.0,0.0,0.0
982,Fox,"('Action',)",168325500,PG-13,Liam Neeson/Famke Janssen,28127709.22761716,Pierre Morel,Luc Besson,2009-01-30,Taken,Luc Besson/Robert Mark Kamen,4.984330207549565,1.0,0.0,0.0,0.0,0.0,0.0,0.0,0.0,0.0,0.0,0.0
983,Fox,"('Action',)",150469800,PG-13,Liam Neeson/Famke Janssen,47164722.34195261,Olivier Megaton,Luc Besson,2012-10-05,Taken 2,Luc Besson/Robert Mark Kamen,2.190303950250512,1.0,0.0,0.0,0.0,0.0,0.0,0.0,0.0,0.0,0.0,0.0
984,Fox,"('Action',)",95168800,PG-13,Liam Neeson/Famke Janssen/Forest Whitaker,48350400.00000001,Olivier Megaton,Luc Besson,2015-01-09,Taken 3,Luc Besson/Robert Mark Kamen,0.9683146364869781,1.0,0.0,0.0,0.0,0.0,0.0,0.0,0.0,0.0,0.0,0.0
985,Sony / Screen Gems,"('Action', 'Crime')",62901800,PG-13,Chris Brown/Hayden Christensen/Matt Dillon/Michael Ealy/Idris Elba/Paul Walker/Zoe Saldana,35050104.95653228,John Luessenhop,Chris Brown/Morris Chestnut/Will Packer,2010-08-27,Takers,John Luessenhop,0.7946251538478493,1.0,0.0,0.0,0.0,1.0,0.0,0.0,0.0,0.0,0.0,0.0
986,Warner Bros.,"('Thriller',)",45576300,R,Angelina Jolie/Ethan Hawke/Kiefer Sutherland/Gena Rowlands,57755694.3006913,D.J. Caruso,Mark Canton/Dana Goldberg/Bernie Goldmann/David Heyman,2004-03-19,Taking Lives,,-0.2108778095070969,0.0,0.0,0.0,0.0,0.0,0.0,0.0,0.0,0.0,0.0,1.0
987,Sony / Columbia,"('Action', 'Thriller')",75980800,R,Denzel Washington/John Travolta/James Gandolfini,112510836.91046864,Tony Scott,Todd Black/Jason Blumenthal/Ryan Kavanaugh/Tony Scott/Steve Tisch,2009-06-12,The Taking of Pelham 1 2 3,Brian Helgeland,-0.3246801633831743,1.0,0.0,0.0,0.0,0.0,0.0,0.0,0.0,0.0,0.0,1.0
988,Focus Features,"('Comedy',)",8659100,R,Demetri Martin/Imelda Staunton/Paul Dano/Jeffrey Dean Morgan/Dan Fogler,33753251.07314059,Ang Lee,,2009-08-26,Taking Woodstock,,-0.7434587861999893,0.0,0.0,0.0,1.0,0.0,0.0,0.0,0.0,0.0,0.0,0.0
989,Universal,"('Animation',)",59899300,G,Matthew Broderick/Dustin Hoffman/Emma Watson,67567257.99821283,Sam Fell,Robin Bissell/Ryan Kavanaugh,2008-12-19,The Tale of Despereaux,,-0.11348629832537604,0.0,0.0,1.0,0.0,0.0,0.0,0.0,0.0,0.0,0.0,0.0
990,Sony / Columbia,"('Comedy',)",195958500,PG-13,Will Ferrell/John C. Reilly/Sacha Baron Cohen/Amy Adams/Michael Clarke Duncan,87133196.73235807,Adam McKay,Judd Apatow/Ryan Kavanaugh/Adam McKay,2006-08-04,Talladega Nights: The Ballad of Ricky Bobby,Will Ferrell/Adam McKay,1.2489534109704965,0.0,0.0,0.0,1.0,0.0,0.0,0.0,0.0,0.0,0.0,0.0
991,Fox,"('Action', 'Comedy')",51041500,PG-13,Queen Latifah,32086496.833717387,Tim Story,Luc Besson/Robert Simonds,2004-10-06,Taxi,Thomas Lennon &amp; Ben Garant,0.5907470442944762,1.0,0.0,0.0,1.0,0.0,0.0,0.0,0.0,0.0,0.0,0.0
992,Sony (Revolution),"('Action', 'Drama')",62810000,R,Monica Bellucci/Bruce Willis,98069168.92257382,Antoine Fuqua,Ian Bryce/Joe Roth/Cathy Schulman*,2003-03-07,Tears of the Sun,,-0.35953367719890783,1.0,0.0,0.0,0.0,0.0,1.0,0.0,0.0,0.0,0.0,0.0
993,Universal,"('Comedy',)",243533300,R,Mark Wahlberg/Mila Kunis/Seth MacFarlane/Giovanni Ribisi,52405247.04661401,Seth MacFarlane,Jason Clark/John Jacobs/Seth MacFarlane/Scott Stuber/Wellesley Wild,2012-06-29,Ted,Seth MacFarlane/Alec Sulkin/Wellesley Wild,3.6471167244642357,0.0,0.0,0.0,1.0,0.0,0.0,0.0,0.0,0.0,0.0,0.0
994,Universal,"('Comedy',)",85525500,R,Mark Wahlberg/Seth MacFarlane/Amanda Seyfried/Morgan Freeman/Giovanni Ribisi/John Slattery/Liam Neeson,68496400.0,Seth MacFarlane,Jason Clark/John Jacobs/Seth MacFarlane/Scott Stuber,2015-06-26,Ted 2,Seth MacFarlane/Alec Sulkin/Wellesley Wild,0.24861306579615872,0.0,0.0,0.0,1.0,0.0,0.0,0.0,0.0,0.0,0.0,0.0
995,Paramount,"('Action', 'Adventure')",204774400,PG-13,Megan Fox/Johnny Knoxville,126869435.00000003,Jonathan Liebesman,Michael Bay/Ian Bryce/Andrew Form/Brad Fuller/Scott Mednick,2014-08-08,Teenage Mutant Ninja Turtles,Josh Appelbaum/Evan Daugherty/Andre Nemec,0.6140562145642088,1.0,1.0,0.0,0.0,0.0,0.0,0.0,0.0,0.0,0.0,0.0
996,Miramax,"('Romance',)",300500,PG-13,Russell Brand/Chris Cooper/Felicity Jones/Helen Mirren/Alfred Molina,21906315.597832676,Julie Taymor,Julie Taymor,2010-12-10,The Tempest,Julie Taymor,-0.986282494714459,0.0,0.0,0.0,0.0,0.0,0.0,0.0,0.0,1.0,0.0,0.0
997,DreamWorks,"('Comedy', 'Drama')",108595700,PG-13,Tom Hanks/Catherine Zeta-Jones/Stanley Tucci,77007592.40092173,Steven Spielberg,Jason Hoffs/Steven Spielberg/Patricia Whitcher,2004-06-18,The Terminal,Sacha Gervasi/Jeff Nathanson/Andrew Niccol*,0.41019471735491075,0.0,0.0,0.0,1.0,0.0,1.0,0.0,0.0,0.0,0.0,0.0
998,Warner Bros.,"('Sci-Fi', 'Action')",145481600,PG-13,Christian Bale/Sam Worthington/Anton Yelchin/Common/Bryce Dallas Howard,225021673.82093728,McG,Dan Lin/Jeffrey Silver,2009-05-21,Terminator Salvation,,-0.3534773894013067,1.0,0.0,0.0,0.0,0.0,0.0,0.0,0.0,0.0,1.0,0.0
999,Paramount,"('Action',)",94221800,PG-13,Arnold Schwarzenegger/Jai Courtney,156131500.0,Alan Taylor,David Ellison/Megan Ellison/Dana Goldberg/Laeta Kalogridis/Patrick Lussier/Paul Schwake,2015-07-01,Terminator: Genisys,Laeta Kalogridis/Patrick Lussier,-0.39652280289371455,1.0,0.0,0.0,0.0,0.0,0.0,0.0,0.0,0.0,0.0,0.0
1000,New Line,"('Horror',)",115696800,R,Jessica Biel/Mike Vogel,12422094.730192684,Marcus Nispel,Michael Bay/Ted Field/Andrew Form/Brad Fuller,2003-10-17,The Texas Chainsaw Massacre,,8.313791475023262,0.0,0.0,0.0,0.0,0.0,0.0,0.0,1.0,0.0,0.0,0.0
1001,Fox Searchlight,"('Comedy',)",32780400,R,Aaron Eckhart/Maria Bello/Adam Brody/Sam Elliott/Katie Holmes/Rob Lowe/William H. Macy/Robert Duvall,7811941.7760045165,Jason Reitman,David Bloomfield,2006-03-17,Thank You for Smoking,Jason Reitman,3.1961910290588227,0.0,0.0,0.0,1.0,0.0,0.0,0.0,0.0,0.0,0.0,0.0
1002,Focus Features,"('Romance', 'Comedy')",28358400,R,Zac Efron/Michael B. Jordan/Miles Teller/Imogen Poots,8119643.840000002,Tom Gormican,Scott Aversano/Zac Efron/Justin Nappi/Andrew O'Connor/Peter Schlessel/Kevin Turen,2014-01-31,That Awkward Moment,Tom Gormican,2.4925669843173806,0.0,0.0,0.0,1.0,0.0,0.0,0.0,0.0,1.0,0.0,0.0
1003,Sony / Columbia,"('Comedy',)",39608600,R,Adam Sandler/Andy Samberg/Leighton Meester/Susan Sarandon,73367345.86525962,Sean Anders,Jack Giarraputo/Tim Herlihy/Heather Parry/Adam Sandler,2012-06-15,That's My Boy,David Caspe,-0.4601331214469463,0.0,0.0,0.0,1.0,0.0,0.0,0.0,0.0,0.0,0.0,0.0
1004,Paramount Vantage,"('Drama',)",48520000,R,Daniel Day-Lewis/Paul Dano,29301667.55189163,Paul Thomas Anderson,Paul Thomas Anderson/Daniel Lupi/Scott Rudin/JoAnne Sellar,2007-12-26,There Will Be Blood,Paul Thomas Anderson,0.6558784551791728,0.0,0.0,0.0,0.0,0.0,1.0,0.0,0.0,0.0,0.0,0.0
1005,Sony / Screen Gems,"('Comedy',)",97651800,PG-13,Michael Ealy/Regina Hall/Kevin Hart/Taraji P. Henson/Chris Brown,12577259.291187363,Tim Story,Rob Hardy/Will Packer,2012-04-20,Think Like a Man,Keith Merryman/David A. Newman,6.764155746429008,0.0,0.0,0.0,1.0,0.0,0.0,0.0,0.0,0.0,0.0,0.0
1006,Sony / Screen Gems,"('Comedy',)",68646200,PG-13,Michael Ealy/Regina Hall/Taraji P. Henson/Kevin Hart,24358931.520000007,Tim Story,Will Packer,2014-06-20,Think Like a Man Too,Keith Merryman/David A. Newman,1.8181121139750211,0.0,0.0,0.0,1.0,0.0,0.0,0.0,0.0,0.0,0.0,0.0
1007,Fox Searchlight,"('Drama',)",6607800,R,Holly Hunter,2615177.8379353015,Catherine Hardwicke,Tim Bevan/Eric Fellner/Michael London,2003-08-20,Thirteen,,1.5267115314868596,0.0,0.0,0.0,0.0,0.0,1.0,0.0,0.0,0.0,0.0,0.0
1008,New Line,"('Action', 'Drama')",52938900,PG-13,Kevin Costner,112443616.89641464,Roger Donaldson,Marc Abraham/Kevin Costner/Michael De Luca,2000-12-22,Thirteen Days,,-0.5291960409920965,1.0,0.0,0.0,0.0,0.0,1.0,0.0,0.0,0.0,0.0,0.0
1009,Universal,"('Comedy',)",73312800,R,Paul Rudd/Leslie Mann/Albert Brooks/Megan Fox/Jason Segel/Melissa McCarthy,36683672.93262981,Judd Apatow,Judd Apatow/Barry Mendel/Clayton Townsend,2012-12-21,This Is 40,Judd Apatow,0.9985130751394553,0.0,0.0,0.0,1.0,0.0,0.0,0.0,0.0,0.0,0.0,0.0
1010,Sony / Columbia,"('Comedy',)",107371200,R,James Franco/Jonah Hill/Seth Rogen/Jay Baruchel/Danny McBride/Michael Cera/Emma Watson,32965753.9904,Evan Goldberg/Seth Rogen,Evan Goldberg/Seth Rogen/James Weaver,2013-06-12,This is the End,Evan Goldberg/Seth Rogen,2.257052759395939,0.0,0.0,0.0,1.0,0.0,0.0,0.0,0.0,0.0,0.0,0.0
1011,Warner Bros.,"('Comedy',)",36225500,R,Jason Bateman/Tina Fey/Rose Byrne/Timothy Olyphant,20096118.504000004,Shawn Levy,Shawn Levy/Jonathan Tropper,2014-09-19,This is Where I Leave You,Jonathan Tropper,0.8026117826081463,0.0,0.0,0.0,1.0,0.0,0.0,0.0,0.0,0.0,0.0,0.0
1012,Fox,"('Action',)",59820700,PG-13,Tom Hardy/Chris Pine/Reese Witherspoon/Angela Bassett,68126821.16059822,McG,Simon Kinberg/James Lassiter/Robert Simonds/Will Smith/Lisa Stewart,2012-02-17,This Means War,Timothy Dowling/Simon Kinberg,-0.1219214550025437,1.0,0.0,0.0,0.0,0.0,0.0,0.0,0.0,0.0,0.0,0.0
1013,Paramount,"('Action', 'Adventure')",194563900,PG-13,Chris Hemsworth/Natalie Portman/Kat Dennings/Anthony Hopkins/Ray Stevenson/Idris Elba/Stellan Skarsgard/Rene Russo/Clark Gregg/Tom Hiddleston,161869327.07758138,Kenneth Branagh,Louis D'Esposito/Kevin Feige/Alan Fine/Stan Lee/David Maisel/Patricia Whitcher,2011-05-06,Thor,Ashley Miller/Don Payne/Zack Stentz,0.20198127410975553,1.0,1.0,0.0,0.0,0.0,0.0,0.0,0.0,0.0,0.0,0.0
1014,Buena Vista,"('Action', 'Adventure')",214255900,PG-13,Chris Hemsworth/Natalie Portman/Tom Hiddleston/Anthony Hopkins/Idris Elba/Stellan Skarsgard/Kat Dennings/Ray Stevenson/Zachary Levi/Rene Russo,175130568.07400003,Alan Taylor,Louis D'Esposito/Kevin Feige/Alan Fine/Stan Lee,2013-11-08,Thor: The Dark World,Christopher Markus/Stephen McFeely/Christopher Yost,0.22340664086390594,1.0,1.0,0.0,0.0,0.0,0.0,0.0,0.0,0.0,0.0,0.0
1015,Paramount (DreamWorks),"('Comedy', 'Drama')",20097400,PG-13,Eddie Murphy/Clark Duke,41924197.63729121,Brian Robbins,Steve Koren/Brian Robbins,2012-03-09,A Thousand Words,Steve Koren,-0.520625292012183,0.0,0.0,0.0,1.0,0.0,1.0,0.0,0.0,0.0,0.0,0.0
1016,Summit Entertainment,"('Action',)",22222000,PG-13,Logan Lerman/Christoph Waltz/Ray Stevenson/Milla Jovovich/Mads Mikkelsen/Orlando Bloom/Juno Temple,80934663.53879069,Paul W.S. Anderson,Paul W.S. Anderson/Jeremy Bolt/Robert Kulzer,2011-10-21,The Three Musketeers,Andrew Davies/Alex Litvak,-0.7254328488145336,1.0,0.0,0.0,0.0,0.0,0.0,0.0,0.0,0.0,0.0,0.0
1017,Fox,"('Comedy',)",47314800,PG,Kate Upton,31443148.227968406,The Farrelly Bros.,The Farrelly Bros./Bradley Thomas/Charles B. Wessler,2012-04-13,The Three Stooges,Mike Cerrone/The Farrelly Bros.,0.5047729844657824,0.0,0.0,0.0,1.0,0.0,0.0,0.0,0.0,0.0,0.0,0.0
1018,DreamWorks,"('Sci-Fi', 'Adventure')",84710700,PG-13,Guy Pearce,107096762.81912647,Simon Wells,John Logan/David Valdes,2002-03-08,The Time Machine,John Logan,-0.2090265123786592,0.0,1.0,0.0,0.0,0.0,0.0,0.0,0.0,0.0,1.0,0.0
1019,Warner Bros. (New Line),"('Romance',)",73564600,PG-13,Rachel McAdams/Eric Bana/Ron Livingston,43879226.39508277,Robert Schwentke,Dede Gardner/Brad Pitt/Nick Wechsler,2009-08-14,The Time Traveler's Wife,,0.6765245434738079,0.0,0.0,0.0,0.0,0.0,0.0,0.0,0.0,1.0,0.0,0.0
1020,Paramount,"('Sci-Fi', 'Adventure')",27958700,PG-13,Paul Walker/Gerard Butler/Anna Friel/Michael Sheen,104607113.51741207,Richard Donner,Lauren Schuler Donner/Jim Van Wyck,2003-11-26,Timeline,George Nolfi,-0.7327265894269588,0.0,1.0,0.0,0.0,0.0,0.0,0.0,0.0,0.0,1.0,0.0
1021,Buena Vista,"('Sci-Fi',)",95912300,PG,George Clooney/Hugh Laurie,191387000.00000003,Brad Bird,Brad Bird/Jeffrey Chernov/Damon Lindelof,2015-05-22,Tomorrowland,Brad Bird/Damon Lindelof,-0.4988567666560425,0.0,0.0,0.0,0.0,0.0,0.0,0.0,0.0,0.0,1.0,0.0
1022,Fox,"('Fantasy', 'Comedy')",65382700,PG,Dwayne Johnson/Julie Andrews/Ashley Judd/Seth MacFarlane/Brandon T. Jackson,52575157.43479842,Michael Lembeck,Jason Blum,2010-01-22,Tooth Fairy,Randi Mayem Singer/Joshua Sternin/Jeffrey Ventimilia,0.2436044548432399,0.0,0.0,0.0,1.0,0.0,0.0,1.0,0.0,0.0,0.0,0.0
1023,Sony / Columbia,"('Sci-Fi', 'Action')",62793500,PG-13,Colin Farrell/Kate Beckinsale/Jessica Biel/Bryan Cranston,131013117.61653502,Len Wiseman,Toby Jaffe/Neal H. Moritz,2012-08-03,Total Recall,Mark Bomback/Kurt Wimmer,-0.5207082989675005,1.0,0.0,0.0,0.0,0.0,0.0,0.0,0.0,0.0,1.0,0.0
1024,Universal,"('Comedy',)",86300000,PG-13,Ben Stiller/Eddie Murphy/Casey Affleck/Matthew Broderick/Tea Leoni/Gabourey Sidibe/Alan Alda,80934663.53879069,Brett Ratner,,2011-11-04,Tower Heist,Ted Griffin/Jeff Nathanson,0.06629219455070445,0.0,0.0,0.0,1.0,0.0,0.0,0.0,0.0,0.0,0.0,0.0
1025,Warner Bros.,"('Crime', 'Drama')",100419200,R,Ben Affleck/Jon Hamm/Rebecca Hall/Chris Cooper/Jeremy Renner/Blake Lively,40526683.85599045,Ben Affleck,Jon Jashni/Graham King/Thomas Tull,2010-09-17,The Town,Ben Affleck/Peter Craig,1.4778538593691661,0.0,0.0,0.0,0.0,1.0,1.0,0.0,0.0,0.0,0.0,0.0
1026,New Line,"('Romance', 'Comedy')",10281800,R,Diane Keaton/Goldie Hawn,122351357.97317581,Peter Chelsom,Michael De Luca/Simon Fields/Sidney Kimmel,2001-04-27,Town & Country,,-0.9159649703090817,0.0,0.0,0.0,1.0,0.0,0.0,0.0,0.0,1.0,0.0,0.0
1027,Buena Vista,"('Animation',)",452068200,G,Tom Hanks/Michael Keaton/Tim Allen,219063155.97832674,Lee Unkrich,Darla K. Anderson/John Lasseter,2010-06-18,Toy Story 3,Michael Arndt/John Lasseter/Andrew Stanton/Lee Unkrich,1.0636432355823717,0.0,0.0,1.0,0.0,0.0,0.0,0.0,0.0,0.0,0.0,0.0
1028,Universal,"('Comedy',)",115657400,R,John Cena/Brie Larson/Ezra Miller/Daniel Radcliffe/Marisa Tomei/Tilda Swinton,35255500.0,Judd Apatow,Judd Apatow/Barry Mendel,2015-07-17,Trainwreck,,2.280549134177646,0.0,0.0,0.0,1.0,0.0,0.0,0.0,0.0,0.0,0.0,0.0
1029,Fox Searchlight,"('Crime', 'Thriller')",2406600,R,James McAvoy/Rosario Dawson,20603596.244000003,Danny Boyle,Steven M. Rales,2013-04-05,Trance,,-0.8831951484828369,0.0,0.0,0.0,0.0,1.0,0.0,0.0,0.0,0.0,0.0,1.0
1030,Warner Bros.,"('Sci-Fi',)",23934400,PG-13,Johnny Depp/Rebecca Hall/Paul Bettany/Cillian Murphy/Morgan Freeman,101495548.00000003,Wally Pfister,Kate Cohen/Broderick Johnson/Andrew A. Kosove/Dan Mintz/Christopher Nolan/Marisa Polvino/Aaron Ryder/Emma Thomas/David Valdes,2014-04-18,Transcendence,Jack Paglen,-0.7641827600162325,0.0,0.0,0.0,0.0,0.0,0.0,0.0,0.0,0.0,1.0,0.0
1031,Paramount (DreamWorks),"('Sci-Fi', 'Action')",401841900,PG-13,Shia LaBeouf/Tyrese Gibson/Josh Duhamel/Megan Fox/Jon Voight,175810005.31134978,Michael Bay,Michael Bay/Ian Bryce/Tom DeSanto/Lorenzo di Bonaventura/Don Murphy/Steven Spielberg/Mark Vahradian,2007-07-03,Transformers,Alex Kurtzman/Roberto Orci,1.285660018543087,1.0,0.0,0.0,0.0,0.0,0.0,0.0,0.0,0.0,1.0,0.0
1032,Paramount,"('Sci-Fi', 'Action')",263053000,PG-13,Mark Wahlberg/Stanley Tucci/Kelsey Grammer,213140650.80000004,Michael Bay,Michael Bay/Ian Bryce/Tom DeSanto/Lorenzo di Bonaventura/Don Murphy/Steven Spielberg/Mark Vahradian,2014-06-27,Transformers: Age of Extinction,Ehren Kruger,0.23417564417045478,1.0,0.0,0.0,0.0,0.0,0.0,0.0,0.0,0.0,1.0,0.0
1033,Paramount (DreamWorks),"('Sci-Fi', 'Action')",383299300,PG-13,Shia LaBeouf/Rosie Huntington-Whiteley/Josh Duhamel/Tyrese Gibson/Frances McDormand/John Malkovich,210430125.2008558,Michael Bay,Michael Bay/Ian Bryce/Tom DeSanto/Lorenzo di Bonaventura/Don Murphy/Steven Spielberg/Mark Vahradian,2011-06-29,Transformers: Dark of the Moon,Ehren Kruger,0.8215039297920883,1.0,0.0,0.0,0.0,0.0,0.0,0.0,0.0,0.0,1.0,0.0
1034,Paramount (DreamWorks),"('Sci-Fi', 'Action')",466782000,PG-13,Shia LaBeouf/Megan Fox/Josh Duhamel/Tyrese Gibson,225021673.82093728,Michael Bay,Michael Bay/Ian Bryce/Tom DeSanto/Lorenzo di Bonaventura/Don Murphy/Steven Spielberg/Mark Vahradian,2009-06-24,Transformers: Revenge of the Fallen,Ehren Kruger/Alex Kurtzman/Roberto Orci,1.0743868449376364,1.0,0.0,0.0,0.0,0.0,0.0,0.0,0.0,0.0,1.0,0.0
1035,Fox,"('Action',)",58223100,PG-13,Jason Statham,39774080.90950829,Louis Leterrier,Luc Besson,2005-09-02,Transporter 2,Luc Besson/Robert Mark Kamen,0.46384526477094123,1.0,0.0,0.0,0.0,0.0,0.0,0.0,0.0,0.0,0.0,0.0
1036,Fox Searchlight,"('Drama',)",14405200,PG-13,Tye Sheridan/Brad Pitt/Sean Penn/Jessica Chastain,34532123.10988402,Terrence Malick,Dede Gardner/Brad Pitt,2011-05-27,The Tree of Life,Terrence Malick,-0.5828463846789413,0.0,0.0,0.0,0.0,0.0,1.0,0.0,0.0,0.0,0.0,0.0
1037,Buena Vista,"('Sci-Fi', 'Action')",186025400,PG,Jeff Bridges/Garrett Hedlund/Olivia Wilde/Michael Sheen,186203682.58157775,Joseph Kosinski,Sean Bailey/Steven Lisberger/Jeffrey Silver,2010-12-17,Tron Legacy,Adam Horowitz/Edward Kitsis/Brian Klugman/Steven Lisberger/Lee Sternthal,-0.0009574600196192717,1.0,0.0,0.0,0.0,0.0,0.0,0.0,0.0,0.0,1.0,0.0
1038,Paramount (DreamWorks),"('Action', 'Comedy')",133295600,R,"Ben Stiller/Jack Black/Robert Downey, Jr./Steve Coogan/Jay Baruchel/Danny McBride/Brandon T. Jackson",103603128.93059301,Ben Stiller,Ben Stiller,2008-08-13,Tropic Thunder,Ben Stiller/Etan Cohen,0.28659820775585754,1.0,0.0,0.0,1.0,0.0,0.0,0.0,0.0,0.0,0.0,0.0
1039,Millennium Ent.,"('Drama',)",132200,R,Clive Owen/Viola Davis,4316515.388735503,David Schwimmer,David Schwimmer,2011-04-01,Trust,,-0.9693734440643967,0.0,0.0,0.0,0.0,0.0,1.0,0.0,0.0,0.0,0.0,0.0
1040,Fox,"('Animation',)",91623500,PG,Ryan Reynolds/Paul Giamatti/Samuel L. Jackson/Michelle Rodriguez/Snoop Dogg,139074274.647,David Soren,Lisa Stewart,2013-07-17,Turbo,Darren Lemke/Robert D. Siegel/David Soren,-0.34119016451777395,0.0,0.0,1.0,0.0,0.0,0.0,0.0,0.0,0.0,0.0,0.0
1041,Fox Atomic,"('Thriller',)",9285500,R,Josh Duhamel/Olivia Wilde,12018371.96308387,John Stockwell,,2006-12-01,Turistas,,-0.2273911950369213,0.0,0.0,0.0,0.0,0.0,0.0,0.0,0.0,0.0,0.0,1.0
1042,Hannover House,"('Thriller',)",206600,R,50 Cent/Chace Crawford/Rory Culkin/Cody Horn/Emma Roberts,5476578.899458169,Joel Schumacher,,2010-08-06,Twelve,,-0.9622757192413607,0.0,0.0,0.0,0.0,0.0,0.0,0.0,0.0,0.0,0.0,1.0
1043,Summit Entertainment,"('Romance',)",231108700,PG-13,Kristen Stewart/Robert Pattinson/Billy Burke/Cam Gigandet/Ashley Greene,41666475.76556458,Catherine Hardwicke,Marty Bowen/Wyck Godfrey/Karen Rosenfelt,2008-11-21,Twilight,Melissa Rosenberg,4.546634212606017,0.0,0.0,0.0,0.0,0.0,0.0,0.0,0.0,1.0,0.0,0.0
1044,Summit Entertainment,"('Romance',)",311006000,PG-13,Robert Pattinson/Kristen Stewart/Taylor Lautner/Ashley Greene/Billy Burke/Kellan Lutz/Jackson Rathbone,118704173.19022633,Bill Condon,Marty Bowen/Wyck Godfrey/Stephenie Meyer/Karen Rosenfelt,2011-11-18,The Twilight Saga: Breaking Dawn Part 1,Melissa Rosenberg,1.6200089823430663,0.0,0.0,0.0,0.0,0.0,0.0,0.0,0.0,1.0,0.0,0.0
1045,Lionsgate/Summit,"('Romance',)",314604900,PG-13,Kristen Stewart/Robert Pattinson/Taylor Lautner/Billy Burke/Ashley Greene/Dakota Fanning/Michael Sheen/Kellan Lutz/Jackson Rathbone,125772592.91187362,Bill Condon,Marty Bowen/Wyck Godfrey/Stephenie Meyer/Karen Rosenfelt,2012-11-16,The Twilight Saga: Breaking Dawn Part 2,Melissa Rosenberg,1.5013788196323299,0.0,0.0,0.0,0.0,0.0,0.0,0.0,0.0,1.0,0.0,0.0
1046,Summit Entertainment,"('Romance',)",327371700,PG-13,Kristen Stewart/Robert Pattinson/Taylor Lautner/Ashley Greene/Billy Burke/Kellan Lutz/Jackson Rathbone/Dakota Fanning,74481473.0326311,David Slade,Marty Bowen/Wyck Godfrey/Karen Rosenfelt,2010-06-30,The Twilight Saga: Eclipse,Melissa Rosenberg,3.395344059006125,0.0,0.0,0.0,0.0,0.0,0.0,0.0,0.0,1.0,0.0,0.0
1047,Summit Entertainment,"('Romance',)",336961300,PG-13,Kristen Stewart/Robert Pattinson/Taylor Lautner/Billy Burke/Ashley Greene/Jackson Rathbone/Kellan Lutz/Michael Sheen,56255418.45523432,Chris Weitz,Marty Bowen/Wyck Godfrey/Karen Rosenfelt,2009-11-20,The Twilight Saga: New Moon,Melissa Rosenberg,4.989846120656618,0.0,0.0,0.0,0.0,0.0,0.0,0.0,0.0,1.0,0.0,0.0
1048,Sony / Screen Gems,"('Romance', 'Comedy')",34021700,R,Mo'Nique,17672973.929458726,Mark Brown,Mark Brown,2001-09-07,Two Can Play That Game,Mark Brown,0.9250693253889719,0.0,0.0,0.0,1.0,0.0,0.0,0.0,0.0,1.0,0.0,0.0
1049,Universal,"('Drama', 'Thriller')",31061700,R,Al Pacino/Matthew McConaughey/Rene Russo,43502900.994774684,D.J. Caruso,James G. Robinson,2005-10-07,Two for the Money,Dan Gilroy,-0.285985548326284,0.0,0.0,0.0,0.0,0.0,1.0,0.0,0.0,0.0,0.0,1.0
1050,Lionsgate,"('Comedy',)",83635700,PG-13,Tyler Perry/Boris Kodjoe,7211023.177850323,Tyler Perry,Tyler Perry,2006-02-24,Tyler Perry's Madea's Family Reunion,Tyler Perry,10.598312463742854,0.0,0.0,0.0,1.0,0.0,0.0,0.0,0.0,0.0,0.0,0.0
1051,Lionsgate,"('Comedy',)",73079300,PG-13,Tyler Perry/Denise Richards/Tom Arnold,20962098.818645604,Tyler Perry,Ozzie Areu/Paul Hall/Tyler Perry,2012-06-29,Tyler Perry's Madea's Witness Protection,Tyler Perry,2.4862587297316145,0.0,0.0,0.0,1.0,0.0,0.0,0.0,0.0,0.0,0.0,0.0
1052,Lionsgate,"('Comedy', 'Drama')",65462900,PG-13,Tyler Perry/Sharon Leal,21906315.597832676,Tyler Perry,Tyler Perry,2010-04-02,Tyler Perry's Why Did I Get Married Too?,Tyler Perry,1.9883117362956573,0.0,0.0,0.0,1.0,0.0,1.0,0.0,0.0,0.0,0.0,0.0
1053,Sony / Columbia,"('Romance', 'Comedy')",103208500,R,Katherine Heigl/Gerard Butler,42754118.02597808,Robert Luketic,Gary Lucchesi/Tom Rosenberg,2009-07-24,The Ugly Truth,Karen McCullah Lutz/Kirsten Smith,1.4140013819788981,0.0,0.0,0.0,1.0,0.0,0.0,0.0,0.0,1.0,0.0,0.0
1054,Sony / Screen Gems,"('Action', 'Horror')",24506900,PG-13,Milla Jovovich,36055115.88925161,Kurt Wimmer,,2006-03-03,Ultraviolet,Kurt Wimmer,-0.32029340648144333,1.0,0.0,0.0,0.0,0.0,0.0,0.0,1.0,0.0,0.0,0.0
1055,Warner Bros.,"('Comedy',)",21853800,PG,Rob Riggle/Wilmer Valderrama/Kristen Wiig,30045929.90770968,Paul Feig,Lauren Schuler Donner,2006-12-08,Unaccompanied Minors,,-0.27265356515418115,0.0,0.0,0.0,1.0,0.0,0.0,0.0,0.0,0.0,0.0,0.0
1056,Universal,"('Horror',)",49534300,PG-13,Gary Oldman/Cam Gigandet/Idris Elba/Carla Gugino,18001733.905674983,David S. Goyer,Michael Bay/Andrew Form/Brad Fuller,2009-01-09,The Unborn,David S. Goyer,1.751640495273874,0.0,0.0,0.0,0.0,0.0,0.0,0.0,1.0,0.0,0.0,0.0
1057,Buena Vista,"('Thriller',)",152111300,PG-13,Bruce Willis/Samuel L. Jackson,105415890.84038872,M. Night Shyamalan,Gary Barber/Roger Birnbaum/Barry Mendel/Sam Mercer/M. Night Shyamalan,2000-11-22,Unbreakable,M. Night Shyamalan,0.442963663137973,0.0,0.0,0.0,0.0,0.0,0.0,0.0,0.0,0.0,0.0,1.0
